### ISSUE TITLE
Getting mDNS to work across two internal IPv6 networks

### ISSUE THREAD

**Issue by Stamgastje** [avahi/avahi#706]
I have a server which has two NICs for internal networks, plus a NIC for the WAN. My ISP assigns me an /56 prefix and the two NICs get an /64 prefix within the assigned /56 prefix. And all clients in the two internal networks can access each other via IPv6.

However: I'm trying to get mDNS working in this setup, to enable clients connected either lan0 or lan1 to resolve each other's hostname to their IPv6 addresses.

I'm usign avahi in reflector mode. But somehow, it's not working.

Can someone help me understand what I'm dong wrong here?

My setup
=

I use the following three devices:

Device 1: a laptop
- hostname: LAPTOP
- OS: Windows 11
- Connected to lan0 on the server
- IPv6: 2003:ff:2708:a910:50d:edd6:8231:d8e0
- IPv6 (temporary): 2003:ff:2708:a910:c871:b29a:c9e7:2b7e
- IPv6 (link-local): fe80::fb64:8209:202b:353e

Device 2: a PC
- hostname: DESKTOP
- OS: Windows 11
- Connected to lan1 on the server
- IPv6: 2003:ff:2708:a911:7780:6d8f:fe7e:51d7
- IPv6 (temporary): 2003:ff:2708:a911:491b:a9a5:b4c4:7351
- IPv6 (link-local): fe80::62e8:5763:1630:7dfa%11

Device 3: a server (router)
- hostname: SERVER
- OS: Linux (Debian testing)
- prefix assigned by my ISP: 2003:ff:2708:a9 (56b)
- IPv6 on lan0: 2003:ff:2708:a910::1
- IPv6 on lan0 (link-local): fe80::aaa1:59ff:feb7:5109 
- IPv6 on lan1: 2003:ff:2708:a911::1
- IPv6 on lan1 (link-local): fe80::8ac9:b3ff:feb4:733

On the server, I run avahi with the following changes to the default configuration:

- allow-interfaces=lo,lan0,lan1
- enable-reflector=yes
- reflect-ipv=yes

The issue
=

From the PC (DESKTOP), I tried ping the laptop (LAPTOP) via its mDNS name:

```
ping -6 LAPTOP.local
Ping request could not find host LAPTOP.local. Please check the name and try again.
```

But it fails to resolve this mDNS name to its IPv6 address. I also tried it in the other direction (ping the desktop from the laptop), but that also fails.

I used tcpdump and windump to capture the mDNS traffic when I executed the ping command above:

### mDNS traffic on the PC

Output of "WinDump.exe -i4 ip6 and port 5353", with comments which I added manually:

```
# ==> request #1
16:03:25.832202 IP6 DESKTOP.localnet.5353 > ff02::fb.5353:  0 AAAA? LAPTOP.local. (32)

# <== reflected request #1
16:03:25.832900 IP6 lan1.localnet.5353 > ff02::fb.5353:  0 AAAA? LAPTOP.local. (32)

# ==> request #2
16:03:26.254668 IP6 DESKTOP.localnet.5353 > ff02::fb.5353:  0 AAAA? LAPTOP.local. (32)

# <== reflected request #2
16:03:26.255033 IP6 lan1.localnet.5353 > ff02::fb.5353:  0 AAAA? LAPTOP.local. (32)

# ==> request #3
16:03:26.668432 IP6 DESKTOP.localnet.5353 > ff02::fb.5353:  0 AAAA? LAPTOP.local. (32)

# <== reflected request #3
16:03:26.668597 IP6 lan1.localnet.5353 > ff02::fb.5353:  0 AAAA? LAPTOP.local. (32)
```

### mDNS traffic on the server (router)

Output of "tcpdump -i any ip6 and port 5353", with comments which I added manually:

```
# ==> request #1 from desktop (LL = 7dfa)
16:03:25.925335 lan1  M   IP6 fe80::62e8:5763:1630:7dfa.mdns > ff02::fb.mdns: 0 AAAA (QM)? LAPTOP.local. (32)

#  *  reflection of request #1 (by avahi)
16:03:25.925582 lan0  Out IP6 lan0.localnet.mdns > ff02::fb.mdns: 0 AAAA (QM)? LAPTOP.local. (32)
16:03:25.925669 lan1  Out IP6 lan1.localnet.mdns > ff02::fb.mdns: 0 AAAA (QM)? LAPTOP.local. (32)

# <== response #1 from laptop (LL = 353e) -- GUA, temp GUA, LL
16:03:25.944566 lan0  M   IP6 fe80::fb64:8209:202b:353e.mdns > ff02::fb.mdns: 0*- [0q] 3/0/0 AAAA 2003:ff:2708:a910:50d:edd6:8231:d8e0, AAAA 2003:ff:2708:a910:c871:b29a:c9e7:2b7e, AAAA fe80::fb64:8209:202b:353e (110)

# ==> request #2 from desktop (LL = 7dfa)
16:03:26.347725 lan1  M   IP6 fe80::62e8:5763:1630:7dfa.mdns > ff02::fb.mdns: 0 AAAA (QM)? LAPTOP.local. (32)

#  *  reflection of request #2 (by avahi)
16:03:26.347732 lan0  Out IP6 lan0.localnet.mdns > ff02::fb.mdns: 0 AAAA (QM)? LAPTOP.local. (32)
16:03:26.347848 lan1  Out IP6 lan1.localnet.mdns > ff02::fb.mdns: 0 AAAA (QM)? LAPTOP.local. (32)

# <== response #2 from laptop (LL = 353e) -- GUA, temp GUA, LL
16:03:26.458172 lan0  M   IP6 fe80::fb64:8209:202b:353e.mdns > ff02::fb.mdns: 0*- [0q] 3/0/0 AAAA 2003:ff:2708:a910:50d:edd6:8231:d8e0, AAAA 2003:ff:2708:a910:c871:b29a:c9e7:2b7e, AAAA fe80::fb64:8209:202b:353e (110)

#  *  reflection of request #3 (by avahi)
16:03:26.761262 lan0  Out IP6 lan0.localnet.mdns > ff02::fb.mdns: 0 AAAA (QM)? LAPTOP.local. (32)
16:03:26.761358 lan1  Out IP6 lan1.localnet.mdns > ff02::fb.mdns: 0 AAAA (QM)? LAPTOP.local. (32)

# ==> request #3 from desktop (LL = 7dfa)
16:03:26.761628 lan1  M   IP6 fe80::62e8:5763:1630:7dfa.mdns > ff02::fb.mdns: 0 AAAA (QM)? LAPTOP.local. (32)

# <== response #3 from laptop (LL = 353e) -- GUA, temp GUA, LL
16:03:26.875924 lan0  M   IP6 fe80::fb64:8209:202b:353e.mdns > ff02::fb.mdns: 0*- [0q] 3/0/0 AAAA 2003:ff:2708:a910:50d:edd6:8231:d8e0, AAAA 2003:ff:2708:a910:c871:b29a:c9e7:2b7e, AAAA fe80::fb64:8209:202b:353e (110)
```

This shows that the request is correctly reflected between the two subnets (lan0, lan1). However, the response from the laptop, connected to lan0, does not get forwarded/reflected to lan1, where the PC is connected.

I must be doing something wrong... but I have no clue what. I would appreciate if someone could give me a hint.

**Comment by timovanroermund** [comment]
Never mind... I had a stupid typo in my firewall rules, which prevented the mDNS responses from being delivered to avahi.
