### ISSUE TITLE
Statically defined avahi service inaccessible, whilst manual published equivalent is accessible

### ISSUE THREAD

**Issue by danpicton** [avahi/avahi#598]
- **OS:** Debian Linux 12.5
- **Kernel:** `Linux myhost 6.1.0-20-amd64 #1 SMP PREEMPT_DYNAMIC Debian 6.1.85-1 (2024-04-11) x86_64 GNU/Linux`

**Description:**
I have set up a simple Python web server on my host, `myhost`, port `9980`. `avahi-daemon` is running on the host and other devices on my network are resolving `myhost.local:9980`. I have tried to advertise the service with a static service file in `/etc/avahi/services/pysite.service`:

```xml
<?xml version="1.0" standalone='no'?><!--*-nxml-*-->
<!DOCTYPE service-group SYSTEM "avahi-service.dtd">
<service-group>
  <name replace-wildcards="yes">%h</name>
  <service>
    <host-name>myhost.local</host-name>
    <port>9980</port>
    <type>_http._tcp</type>
  </service>
</service-group>
```

I _think_ this configuration is correct, though I am not 100% on the `host-name` setting. Consequently, I have also tried `pysite.local` and `localhost`.

When I restart `avahi-daemon`, the service appears to be established:

```
May 05 15:15:46 myhost systemd[1]: Starting avahi-daemon.service - Avahi mDNS/DNS-SD Stack...
May 05 15:15:46 myhost avahi-daemon[116423]: Process 116405 died: No such process; trying to remove PID file. (/run/avahi-daemon//pid)
May 05 15:15:46 myhost avahi-daemon[116423]: Found user 'avahi' (UID 102) and group 'avahi' (GID 109).
May 05 15:15:46 myhost avahi-daemon[116423]: Successfully dropped root privileges.
May 05 15:15:46 myhost avahi-daemon[116423]: avahi-daemon 0.8 starting up.
May 05 15:15:46 myhost systemd[1]: Started avahi-daemon.service - Avahi mDNS/DNS-SD Stack.
May 05 15:15:46 myhost avahi-daemon[116423]: Successfully called chroot().
May 05 15:15:46 myhost avahi-daemon[116423]: Successfully dropped remaining capabilities.
May 05 15:15:46 myhost avahi-daemon[116423]: Loading service file /services/pysite.service.
May 05 15:15:46 myhost avahi-daemon[116423]: Joining mDNS multicast group on interface eno1.IPv6 with address fe80::9afa:9bff:fe7b:2bf9.
May 05 15:15:46 myhost avahi-daemon[116423]: New relevant interface eno1.IPv6 for mDNS.
May 05 15:15:46 myhost avahi-daemon[116423]: Joining mDNS multicast group on interface eno1.IPv4 with address 192.168.0.199.
May 05 15:15:46 myhost avahi-daemon[116423]: New relevant interface eno1.IPv4 for mDNS.
May 05 15:15:46 myhost avahi-daemon[116423]: Joining mDNS multicast group on interface lo.IPv6 with address ::1.
May 05 15:15:46 myhost avahi-daemon[116423]: New relevant interface lo.IPv6 for mDNS.
May 05 15:15:46 myhost avahi-daemon[116423]: Joining mDNS multicast group on interface lo.IPv4 with address 127.0.0.1.
May 05 15:15:46 myhost avahi-daemon[116423]: New relevant interface lo.IPv4 for mDNS.
May 05 15:15:46 myhost avahi-daemon[116423]: Network interface enumeration completed.
May 05 15:15:46 myhost avahi-daemon[116423]: Registering new address record for fe80::9afa:9bff:fe7b:2bf9 on eno1.*.
May 05 15:15:46 myhost avahi-daemon[116423]: Registering new address record for 192.168.0.199 on eno1.IPv4.
May 05 15:15:46 myhost avahi-daemon[116423]: Registering new address record for ::1 on lo.*.
May 05 15:15:46 myhost avahi-daemon[116423]: Registering new address record for 127.0.0.1 on lo.IPv4.
May 05 15:15:47 myhost avahi-daemon[116423]: Server startup complete. Host name is myhost.local. Local service cookie is 353203058.
May 05 15:15:47 myhost avahi-daemon[116423]: Service "myhost" (/services/pysite.service) successfully established.
```

When I run `avahi-daemon` in debug mode, this is the only difference I see:

```
simple-protocol.c: Got RESOLVE-HOSTNAME-IPV4 request for 'pysite.local'.
```

The problem is, when I try and resolve `pysite.local`, or even `pysite.local:9980`, I can't reach the site:

```
pysite.local’s DNS address could not be found. Diagnosing the problem.
DNS_PROBE_POSSIBLE
```

However, when I manually advertise using `avahi-publish -a -R pysite.local 192.168.0.199`, the service is instantly accessible at `pysite.local:9980`.

**Steps to reproduce:**
1. Configure Avahi with the above service file.
2. Run a basic Python web server: `python -m http.server 9980`
3. Try accessing `pysite.local` from a browser.

**Expected behavior:**
The hostname `pysite.local` resolved to the IP of the host and successfully connected to the web server.

**Actual behavior:**
Unable to access the `pysite.local` unless manually advertised with `avahi-publish`.

Please could you assist in investigating why the service file doesn't seem effective whereas manual advertising works? I'm sure it must be a misconfiguration, but after reading the Avahi static service man pages, scouring the web and much trial and error, I am still no better off.

Many thanks in advance.

**Comment by danpicton** [comment]
I have run `tcpdump` on `5353` on my host and pinged it from another machine with the following results:

```
$  sudo tcpdump port 5353
tcpdump: verbose output suppressed, use -v[v]... for full protocol decode
listening on eno1, link-type EN10MB (Ethernet), snapshot length 262144 bytes
19:01:32.360241 IP 192.168.0.17.mdns > mdns.mcast.net.mdns: 0 A (QM)? pysite.local. (30)
19:01:33.471110 IP 192.168.0.17.mdns > mdns.mcast.net.mdns: 0 A (QM)? pysite.local. (30)
19:01:35.720844 IP 192.168.0.17.mdns > mdns.mcast.net.mdns: 0 A (QM)? pysite.local. (30)
```

**Comment by evverx** [comment]
To judge from
```
Server startup complete. Host name is myhost.local. Local service cookie is 353203058.
```
the service is published by `myhost.local` and its addresses (A/AAAA resource records) are advertised by `avahi`.

The `<host-name>` setting affects SRV resource records only so with something like
```sh
<host-name>pysite.local</host-name>
```
`avahi` announces SRV resource records pointing `myhost._http._tcp.local` to `pysite.local`:
```sh
        myhost._http._tcp.local: type SRV, class IN, cache flush, priority 0, weight 0, port 9980, target pysite.local                                        
            Service: myhost                                                                                                                                   
            Protocol: _http                                                                                                                                   
            Name: _tcp.local                                                                                                                                  
            Type: SRV (Server Selection) (33)                                                                                                                 
            .000 0000 0000 0001 = Class: IN (0x0001)                                                                                                          
            1... .... .... .... = Cache flush: True                                                                                                           
            Time to live: 120 (2 minutes)                                                                                                                     
            Data length: 15                                                                                                                                   
            Priority: 0                                                                                                                                       
            Weight: 0                                                                                                                                         
            Port: 9980                                                                                                                                        
            Target: pysite.local            
```
but `pysite.local` isn't resolvable unless its A/AAAA resource records are announced as well and that's what `avahi-publish -a` does.

(Generally I'm not sure why the service file is needed here given that host names are just resolved directly)

Anyway
```
       <host-name> The host name of the host that provides this service. This should be a host that is resolvable by multicast or unicast DNS. Please note
       that you need to specify a fully-qualified domain name (FQDN) here, i.e. .local is not appended implicitly! The host name doesn't need to be part
       of the domain specified in <domain-name>. See avahi.hosts(5) for more information how to publish additional host name mappings.
```

**Comment by danpicton** [comment]
Thanks for the clarification, @evverx - I assumed it was a misunderstanding on my part.
