### ISSUE TITLE
dbus queries handled as legacy_unicast

### ISSUE THREAD

**Issue by g0tar** [avahi/avahi#666]
**Avahi version**
0.8

**Distribution**
PLD Linux

**Describe the bug**
`avahi-browse -r` results in lots of `Record [...] not fitting in legacy unicast packet, dropping.`

**To Reproduce**
1. create some services to publish, e.g. I've created a bunch of:

```
<service-group>
  <name>testN</name>
  <service protocol="ipv4">
    <type>_device_info._tcp</type>
    <port>0</port>
    <host-name>testN.local.</host-name>
  </service>
</service-group>

```
and made these testN.local. hosts resolvable (via `/etc/avahi/hosts`).

2. **from the same host**, query `avahi-browse -krc _device_info._tcp`
3. observe the daemon logs.

**Expected behavior**
No legacy unicast preparations, clean logs.

Might be this the reason?
https://github.com/avahi/avahi/blob/master/avahi-core/server.c#L981

I don't see any possible source of unicast, therefore it shouldn't be related to #23 and similar. Moreover, -c should prevent any possible network side-effects.

Worth noting is the fact, that the same query (without -c of course), but from another machine, doesn't pollute logs. In both cases the client receives responses.

**Comment by evverx** [comment]
> observe the daemon logs.

I can't reproduce it.

(I can reproduce it by sending legacy unicast queries and that's what https://github.com/avahi/avahi/issues/23 is about)

> I don't see any possible source of unicast

Have you tried capturing legacy unicast queries (where the dstport is 5353 and the src port isn't 5353) to see where they come from? avahi itself doesn't send queries like that. If that happens every time `avahi-browse -r` is issued and there are no actual legacy unicast queries anywhere it would be great to update the description and mention what all the configs (including the hosts file and the avahi config) look like exactly, run avahi-daemon with the `--debug` option and attach the logs (where it can be possible to correlate `avahi-browse` invocations with the "Record [...] not fitting in legacy unicast packet, dropping." messages).

**Comment by g0tar** [comment]
There are **no** external unicast queries - that is what this ticket is about. I did a minimal reproducer for this - it requires at least 40 services of a type to be published (`nas` being my local hostname):

`/etc/avahi/services#  for i in $(seq -w 40); do echo "<service-group><name>test$i</name><service protocol=\"ipv4\"><type>_device_info._tcp</type><port>$i</port><host-name>nas.local.</host-name></service></service-group>" > test$i.service; done
`

Previously I got less services (~30), but with variable length `name` and `host-name` (and `subtype` defined), therefore the actual threshold probably depends on the record details (and something overflows).
As the `dbus-query` is about RFC 6763 not 6762, the `hosts` file should not matter, and I haven't found any option in `avahi-daemon.conf` that makes any difference, so please try to reproduce with 40+ services: `avahi-browse -krc _device_info._tcp`.

The logs are pretty straightforward and maybe worth noting, that the "bogus" `Record` entries are for test01..32 only, not for all 40:

```
dbus-protocol.c: interface=org.freedesktop.Avahi.Server, path=/, member=GetAPIVersion
dbus-protocol.c: interface=org.freedesktop.Avahi.Server, path=/, member=GetState
dbus-protocol.c: interface=org.freedesktop.Avahi.Server, path=/, member=ServiceBrowserNew
dbus-protocol.c: interface=org.freedesktop.Avahi.Server, path=/, member=ServiceResolverNew
dbus-protocol.c: interface=org.freedesktop.Avahi.Server, path=/, member=ServiceResolverNew
dbus-protocol.c: interface=org.freedesktop.Avahi.Server, path=/, member=ServiceResolverNew
[...]
dbus-protocol.c: interface=org.freedesktop.Avahi.Server, path=/, member=ServiceResolverNew
dbus-protocol.c: interface=org.freedesktop.Avahi.Server, path=/, member=ServiceResolverNew
dbus-async-service-resolver.c: interface=org.freedesktop.Avahi.ServiceResolver, path=/Client0/ServiceResolver2, member=Free
dbus-async-service-resolver.c: interface=org.freedesktop.Avahi.ServiceResolver, path=/Client0/ServiceResolver3, member=Free
dbus-async-service-resolver.c: interface=org.freedesktop.Avahi.ServiceResolver, path=/Client0/ServiceResolver4, member=Free
dbus-async-service-resolver.c: interface=org.freedesktop.Avahi.ServiceResolver, path=/Client0/ServiceResolver5, member=Free
[...]
dbus-async-service-resolver.c: interface=org.freedesktop.Avahi.ServiceResolver, path=/Client0/ServiceResolver61, member=Free
dbus-async-service-resolver.c: interface=org.freedesktop.Avahi.ServiceResolver, path=/Client0/ServiceResolver62, member=Free
Record [_device_info._tcp.local IN      PTR test32._device_info._tcp.local ; ttl=4500] not fitting in legacy unicast packet, dropping.
Record [test32._device_info._tcp.local  IN      TXT  ; ttl=4500] not fitting in legacy unicast packet, dropping.
Record [test32._device_info._tcp.local  IN      SRV 0 0 32 nas.local ; ttl=120] not fitting in legacy unicast packet, dropping.
Record [_device_info._tcp.local IN      PTR test31._device_info._tcp.local ; ttl=4500] not fitting in legacy unicast packet, dropping.
Record [test31._device_info._tcp.local  IN      TXT  ; ttl=4500] not fitting in legacy unicast packet, dropping.
[...]
Record [_device_info._tcp.local IN      PTR test01._device_info._tcp.local ; ttl=4500] not fitting in legacy unicast packet, dropping.
Record [test01._device_info._tcp.local  IN      TXT  ; ttl=4500] not fitting in legacy unicast packet, dropping.
Record [test01._device_info._tcp.local  IN      SRV 0 0 1 nas.local ; ttl=120] not fitting in legacy unicast packet, dropping.
dbus-async-service-resolver.c: interface=org.freedesktop.Avahi.ServiceResolver, path=/Client0/ServiceResolver63, member=Free
dbus-async-service-resolver.c: interface=org.freedesktop.Avahi.ServiceResolver, path=/Client0/ServiceResolver64, member=Free
dbus-async-service-resolver.c: interface=org.freedesktop.Avahi.ServiceResolver, path=/Client0/ServiceResolver65, member=Free
[...]
dbus-async-service-resolver.c: interface=org.freedesktop.Avahi.ServiceResolver, path=/Client0/ServiceResolver80, member=Free
dbus-async-service-resolver.c: interface=org.freedesktop.Avahi.ServiceResolver, path=/Client0/ServiceResolver81, member=Free
dbus-protocol.c: client :1.3212 vanished.
```

**Comment by evverx** [comment]
> please try to reproduce with 40+ services

I tried to reproduce it with 100 services and those messages didn't show up.

> As the dbus-query is about RFC 6763 not 6762, the hosts file should not matter, and I haven't found any option in avahi-daemon.conf that makes any difference

It isn't about the RFCs. It's about the exact steps to reproduce the issue reliably.

**Comment by g0tar** [comment]
I can't guess what kind of environment might affect this if you can't... I've got 11 network interfaces, 4 of them have multicast flag - might this influence this? No SELinux, no apparmor, no confinement (systemd, sandboxing, containers - just baremetal host), IPv6 disabled. Otherwise there's nothing more I can provide to reproduce, here you have with packages from another distro, with their patchset and build-time options, without any config nor hosts file, just services:

```
/dev/shm/empty#  mount -o remount,exec /dev/shm
/dev/shm/empty#  wget https://kojipkgs.fedoraproject.org//packages/avahi/0.8/30.fc42/x86_64/avahi-0.8-30.fc42.x86_64.rpm
/dev/shm/empty#  wget https://kojipkgs.fedoraproject.org//packages/avahi/0.8/30.fc42/x86_64/avahi-libs-0.8-30.fc42.x86_64.rpm
/dev/shm/empty#  rpm2cpio avahi-0.8-30.fc42.x86_64.rpm | cpio -idmv
/dev/shm/empty#  rpm2cpio avahi-libs-0.8-30.fc42.x86_64.rpm | cpio -idmv
/dev/shm/empty#  rm -rf /etc/avahi/; echo "yes, everyone loves hardcoded paths"
/dev/shm/empty#  umask 022; mkdir -p /etc/avahi/services
/dev/shm/empty#  for i in $(seq -w 40); do echo "<service-group><name>test$i</name><service protocol=\"ipv4\"><type>_device_info._tcp</type><port>$i</port><host-name>nas.local.</host-name></service></service-group>" > /etc/avahi/services/test$i.service; done
# hostname nas
/dev/shm/empty#  LD_LIBRARY_PATH=./usr/lib64 ./usr/sbin/avahi-daemon -f /dev/null --debug
```

`ip link set dev g1 multicast off` "fixes" this and removes both **bogus** startup log lines and **bogus** response logs:
```
[startup]
Invalid legacy unicast query packet.
Received response from host A.B.6.9 with invalid source port 24606 on interface 'g1.0'
[response]
Record [test14._device_info._tcp.local  IN      TXT  ; ttl=4500] not fitting in legacy unicast packet, dropping.
```

Packets reported as "invalid unicast" are self-generated (originating A.B.6.9), **OUTbound** multicasts:

```
[startup ones]
#  tcpdump -ni g1 ip -Q in
[empty]
#  tcpdump -ni g1 ip
tcpdump: verbose output suppressed, use -v or -vv for full protocol decode
listening on g1, link-type EN10MB (Ethernet), capture size 262144 bytes
09:26:52.055762 IP A.B.6.9.26806 > 224.0.0.251.5353: 0 [12q] [24n] ANY (QM)? test40._device_info._tcp.local. ANY (QM)? test01._device_info._tcp.local. ANY (QM)? test02._device_info._tcp.local. ANY (QM)? test03._device_info._tcp.local. ANY (QM)? test04._device_info._tcp.local. ANY (QM)? test05._device_info._tcp.local. ANY (QM)? test06._device_info._tcp.local. ANY (QM)? test07._device_info._tcp.local. ANY (QM)? test08._device_info._tcp.local. ANY (QM)? test09._device_info._tcp.local. ANY (QM)? test10._device_info._tcp.local. ANY (QM)? test11._device_info._tcp.local. (591)
[...]
09:26:52.759746 IP A.B.6.9.26806 > 224.0.0.251.5353: 0*- [0q] 38/0/0 (Cache flush) TXT "", PTR test29._device_info._tcp.local., (Cache flush) SRV nas.local.:29 0 0, (Cache flush) A 10.10.8.9, (Cache flush) TXT "", PTR test30._device_info._tcp.local., (Cache flush) SRV nas.local.:30 0 0, (Cache flush) TXT "", PTR test31._device_info._tcp.local., (Cache flush) SRV nas.local.:31 0 0, (Cache flush) TXT "", PTR test32._device_info._tcp.local., (Cache flush) SRV nas.local.:32 0 0, (Cache flush) TXT "", PTR test33._device_info._tcp.local., (Cache flush) SRV nas.local.:33 0 0, (Cache flush) TXT "", PTR test34._device_info._tcp.local., (Cache flush) SRV nas.local.:34 0 0, (Cache flush) TXT "", PTR test35._device_info._tcp.local., (Cache flush) SRV nas.local.:35 0 0, (Cache flush) TXT "", PTR test36._device_info._tcp.local., (Cache flush) SRV nas.local.:36 0 0, (Cache flush) TXT "", PTR test37._device_info._tcp.local., (Cache flush) SRV nas.local.:37 0 0, (Cache flush) TXT "", PTR test38._device_info._tcp.local., (Cache flush) SRV nas.local.:38 0 0, (Cache flush) TXT "", PTR test39._device_info._tcp.local., (Cache flush) SRV nas.local.:39 0 0, (Cache flush) TXT "", PTR test40._device_info._tcp.local., (Cache flush) SRV nas.local.:40 0 0, PTR _device_info._tcp.local. (740)

[and query - single packet]
09:28:41.237239 IP A.B.6.9.44850 > 224.0.0.251.5353: 0 PTR (QM)? _device_info._tcp.local. (41)
```

Full startup log:
```
Process 22992 died: No such process; trying to remove PID file. (/run/avahi-daemon//pid)
Found user 'avahi' (UID 165) and group 'avahi' (GID 165).
Successfully dropped root privileges.
avahi-daemon 0.8 starting up.
chroot.c: chroot() helper started
Successfully called chroot().
Successfully dropped remaining capabilities.
chroot.c: chroot() helper got command 02
Loading service file /services/test01.service.
Loading service file /services/test02.service.
Loading service file /services/test03.service.
Loading service file /services/test04.service.
Loading service file /services/test05.service.
Loading service file /services/test06.service.
Loading service file /services/test07.service.
Loading service file /services/test08.service.
Loading service file /services/test09.service.
Loading service file /services/test10.service.
Loading service file /services/test11.service.
Loading service file /services/test12.service.
Loading service file /services/test13.service.
Loading service file /services/test14.service.
Loading service file /services/test15.service.
Loading service file /services/test16.service.
Loading service file /services/test17.service.
Loading service file /services/test18.service.
Loading service file /services/test19.service.
Loading service file /services/test20.service.
Loading service file /services/test21.service.
Loading service file /services/test22.service.
Loading service file /services/test23.service.
Loading service file /services/test24.service.
Loading service file /services/test25.service.
Loading service file /services/test26.service.
Loading service file /services/test27.service.
Loading service file /services/test28.service.
Loading service file /services/test29.service.
Loading service file /services/test30.service.
Loading service file /services/test31.service.
Loading service file /services/test32.service.
Loading service file /services/test33.service.
Loading service file /services/test34.service.
Loading service file /services/test35.service.
Loading service file /services/test36.service.
Loading service file /services/test37.service.
Loading service file /services/test38.service.
Loading service file /services/test39.service.
Loading service file /services/test40.service.
socket() failed: Address family not supported by protocol
Failed to create IPv6 socket, proceeding in IPv4 only mode
Joining mDNS multicast group on interface w6.IPv4 with address A.B.6.9.
New relevant interface w6.IPv4 for mDNS.
Joining mDNS multicast group on interface g3.IPv4 with address C.D.100.9.
New relevant interface g3.IPv4 for mDNS.
Joining mDNS multicast group on interface g1.IPv4 with address C.D.8.9.
New relevant interface g1.IPv4 for mDNS.
Joining mDNS multicast group on interface lo.IPv4 with address 127.0.0.1.
New relevant interface lo.IPv4 for mDNS.
Network interface enumeration completed.
Registering new address record for A.B.6.9 on w6.IPv4.
Registering new address record for C.D.100.9 on g3.IPv4.
Registering new address record for C.D.8.9 on g1.IPv4.
Registering new address record for 127.0.0.1 on lo.IPv4.
Invalid legacy unicast query packet.
Invalid legacy unicast query packet.
Invalid legacy unicast query packet.
Server startup complete. Host name is nas.local. Local service cookie is 3578877376.
Received response from host A.B.6.9 with invalid source port 24606 on interface 'g1.0'
Invalid legacy unicast query packet.
Invalid legacy unicast query packet.
Invalid legacy unicast query packet.
Invalid legacy unicast query packet.
Invalid legacy unicast query packet.
Invalid legacy unicast query packet.
Invalid legacy unicast query packet.
Invalid legacy unicast query packet.
Invalid legacy unicast query packet.
Invalid legacy unicast query packet.
Invalid legacy unicast query packet.
Invalid legacy unicast query packet.
Service "test40" (/services/test40.service) successfully established.
Service "test39" (/services/test39.service) successfully established.
Service "test38" (/services/test38.service) successfully established.
Service "test37" (/services/test37.service) successfully established.
Service "test36" (/services/test36.service) successfully established.
Service "test35" (/services/test35.service) successfully established.
Service "test34" (/services/test34.service) successfully established.
Service "test33" (/services/test33.service) successfully established.
Service "test32" (/services/test32.service) successfully established.
Service "test31" (/services/test31.service) successfully established.
Service "test30" (/services/test30.service) successfully established.
Service "test29" (/services/test29.service) successfully established.
Service "test28" (/services/test28.service) successfully established.
Service "test27" (/services/test27.service) successfully established.
Service "test26" (/services/test26.service) successfully established.
Service "test25" (/services/test25.service) successfully established.
Service "test24" (/services/test24.service) successfully established.
Service "test23" (/services/test23.service) successfully established.
Service "test22" (/services/test22.service) successfully established.
Service "test21" (/services/test21.service) successfully established.
Service "test20" (/services/test20.service) successfully established.
Service "test19" (/services/test19.service) successfully established.
Service "test18" (/services/test18.service) successfully established.
Service "test17" (/services/test17.service) successfully established.
Service "test16" (/services/test16.service) successfully established.
Service "test15" (/services/test15.service) successfully established.
Service "test14" (/services/test14.service) successfully established.
Service "test13" (/services/test13.service) successfully established.
Service "test12" (/services/test12.service) successfully established.
Service "test11" (/services/test11.service) successfully established.
Service "test10" (/services/test10.service) successfully established.
Service "test09" (/services/test09.service) successfully established.
Service "test08" (/services/test08.service) successfully established.
Service "test07" (/services/test07.service) successfully established.
Service "test06" (/services/test06.service) successfully established.
Service "test05" (/services/test05.service) successfully established.
Service "test04" (/services/test04.service) successfully established.
Service "test03" (/services/test03.service) successfully established.
Service "test02" (/services/test02.service) successfully established.
Service "test01" (/services/test01.service) successfully established.
Received response from host A.B.6.9 with invalid source port 24606 on interface 'g1.0'
Received response from host A.B.6.9 with invalid source port 24606 on interface 'g1.0'
Received response from host A.B.6.9 with invalid source port 24606 on interface 'g1.0'
Received response from host A.B.6.9 with invalid source port 24606 on interface 'g1.0'
Received response from host A.B.6.9 with invalid source port 24606 on interface 'g1.0'
Received response from host A.B.6.9 with invalid source port 24606 on interface 'g1.0'
Received response from host A.B.6.9 with invalid source port 24606 on interface 'g1.0'
Received response from host A.B.6.9 with invalid source port 24606 on interface 'g1.0'
Received response from host A.B.6.9 with invalid source port 24606 on interface 'g1.0'
Received response from host A.B.6.9 with invalid source port 24606 on interface 'g1.0'
Received response from host A.B.6.9 with invalid source port 24606 on interface 'g1.0'
Received response from host A.B.6.9 with invalid source port 24606 on interface 'g1.0'
Received response from host A.B.6.9 with invalid source port 24606 on interface 'g1.0'
Received response from host A.B.6.9 with invalid source port 24606 on interface 'g1.0'
Received response from host A.B.6.9 with invalid source port 24606 on interface 'g1.0'
Received response from host A.B.6.9 with invalid source port 24606 on interface 'g1.0'
Received response from host A.B.6.9 with invalid source port 24606 on interface 'g1.0'
Received response from host A.B.6.9 with invalid source port 24606 on interface 'g1.0'
Received response from host A.B.6.9 with invalid source port 24606 on interface 'g1.0'
Received response from host A.B.6.9 with invalid source port 24606 on interface 'g1.0'
Received response from host A.B.6.9 with invalid source port 24606 on interface 'g1.0'
Received response from host A.B.6.9 with invalid source port 24606 on interface 'g1.0'
Received response from host A.B.6.9 with invalid source port 24606 on interface 'g1.0'
```

Full query log follows:

```
dbus-protocol.c: interface=org.freedesktop.Avahi.Server, path=/, member=GetAPIVersion
dbus-protocol.c: interface=org.freedesktop.Avahi.Server, path=/, member=GetState
dbus-protocol.c: interface=org.freedesktop.Avahi.Server, path=/, member=ServiceBrowserNew
dbus-protocol.c: interface=org.freedesktop.Avahi.Server, path=/, member=ServiceResolverNew
dbus-protocol.c: interface=org.freedesktop.Avahi.Server, path=/, member=ServiceResolverNew
dbus-protocol.c: interface=org.freedesktop.Avahi.Server, path=/, member=ServiceResolverNew
dbus-protocol.c: interface=org.freedesktop.Avahi.Server, path=/, member=ServiceResolverNew
dbus-protocol.c: interface=org.freedesktop.Avahi.Server, path=/, member=ServiceResolverNew
dbus-protocol.c: interface=org.freedesktop.Avahi.Server, path=/, member=ServiceResolverNew
dbus-protocol.c: interface=org.freedesktop.Avahi.Server, path=/, member=ServiceResolverNew
dbus-protocol.c: interface=org.freedesktop.Avahi.Server, path=/, member=ServiceResolverNew
dbus-protocol.c: interface=org.freedesktop.Avahi.Server, path=/, member=ServiceResolverNew
dbus-protocol.c: interface=org.freedesktop.Avahi.Server, path=/, member=ServiceResolverNew
dbus-protocol.c: interface=org.freedesktop.Avahi.Server, path=/, member=ServiceResolverNew
dbus-protocol.c: interface=org.freedesktop.Avahi.Server, path=/, member=ServiceResolverNew
dbus-protocol.c: interface=org.freedesktop.Avahi.Server, path=/, member=ServiceResolverNew
dbus-protocol.c: interface=org.freedesktop.Avahi.Server, path=/, member=ServiceResolverNew
dbus-protocol.c: interface=org.freedesktop.Avahi.Server, path=/, member=ServiceResolverNew
dbus-protocol.c: interface=org.freedesktop.Avahi.Server, path=/, member=ServiceResolverNew
dbus-protocol.c: interface=org.freedesktop.Avahi.Server, path=/, member=ServiceResolverNew
dbus-protocol.c: interface=org.freedesktop.Avahi.Server, path=/, member=ServiceResolverNew
dbus-protocol.c: interface=org.freedesktop.Avahi.Server, path=/, member=ServiceResolverNew
dbus-protocol.c: interface=org.freedesktop.Avahi.Server, path=/, member=ServiceResolverNew
dbus-protocol.c: interface=org.freedesktop.Avahi.Server, path=/, member=ServiceResolverNew
dbus-protocol.c: interface=org.freedesktop.Avahi.Server, path=/, member=ServiceResolverNew
dbus-protocol.c: interface=org.freedesktop.Avahi.Server, path=/, member=ServiceResolverNew
dbus-protocol.c: interface=org.freedesktop.Avahi.Server, path=/, member=ServiceResolverNew
dbus-protocol.c: interface=org.freedesktop.Avahi.Server, path=/, member=ServiceResolverNew
dbus-protocol.c: interface=org.freedesktop.Avahi.Server, path=/, member=ServiceResolverNew
dbus-protocol.c: interface=org.freedesktop.Avahi.Server, path=/, member=ServiceResolverNew
dbus-protocol.c: interface=org.freedesktop.Avahi.Server, path=/, member=ServiceResolverNew
dbus-protocol.c: interface=org.freedesktop.Avahi.Server, path=/, member=ServiceResolverNew
dbus-protocol.c: interface=org.freedesktop.Avahi.Server, path=/, member=ServiceResolverNew
dbus-protocol.c: interface=org.freedesktop.Avahi.Server, path=/, member=ServiceResolverNew
dbus-protocol.c: interface=org.freedesktop.Avahi.Server, path=/, member=ServiceResolverNew
dbus-protocol.c: interface=org.freedesktop.Avahi.Server, path=/, member=ServiceResolverNew
dbus-protocol.c: interface=org.freedesktop.Avahi.Server, path=/, member=ServiceResolverNew
dbus-protocol.c: interface=org.freedesktop.Avahi.Server, path=/, member=ServiceResolverNew
dbus-protocol.c: interface=org.freedesktop.Avahi.Server, path=/, member=ServiceResolverNew
dbus-protocol.c: interface=org.freedesktop.Avahi.Server, path=/, member=ServiceResolverNew
dbus-protocol.c: interface=org.freedesktop.Avahi.Server, path=/, member=ServiceResolverNew
dbus-protocol.c: interface=org.freedesktop.Avahi.Server, path=/, member=ServiceResolverNew
dbus-protocol.c: interface=org.freedesktop.Avahi.Server, path=/, member=ServiceResolverNew
dbus-protocol.c: interface=org.freedesktop.Avahi.Server, path=/, member=ServiceResolverNew
dbus-protocol.c: interface=org.freedesktop.Avahi.Server, path=/, member=ServiceResolverNew
dbus-protocol.c: interface=org.freedesktop.Avahi.Server, path=/, member=ServiceResolverNew
dbus-protocol.c: interface=org.freedesktop.Avahi.Server, path=/, member=ServiceResolverNew
dbus-protocol.c: interface=org.freedesktop.Avahi.Server, path=/, member=ServiceResolverNew
dbus-protocol.c: interface=org.freedesktop.Avahi.Server, path=/, member=ServiceResolverNew
dbus-protocol.c: interface=org.freedesktop.Avahi.Server, path=/, member=ServiceResolverNew
dbus-protocol.c: interface=org.freedesktop.Avahi.Server, path=/, member=ServiceResolverNew
dbus-protocol.c: interface=org.freedesktop.Avahi.Server, path=/, member=ServiceResolverNew
dbus-protocol.c: interface=org.freedesktop.Avahi.Server, path=/, member=ServiceResolverNew
dbus-protocol.c: interface=org.freedesktop.Avahi.Server, path=/, member=ServiceResolverNew
dbus-protocol.c: interface=org.freedesktop.Avahi.Server, path=/, member=ServiceResolverNew
dbus-protocol.c: interface=org.freedesktop.Avahi.Server, path=/, member=ServiceResolverNew
dbus-protocol.c: interface=org.freedesktop.Avahi.Server, path=/, member=ServiceResolverNew
dbus-protocol.c: interface=org.freedesktop.Avahi.Server, path=/, member=ServiceResolverNew
dbus-protocol.c: interface=org.freedesktop.Avahi.Server, path=/, member=ServiceResolverNew
dbus-protocol.c: interface=org.freedesktop.Avahi.Server, path=/, member=ServiceResolverNew
dbus-protocol.c: interface=org.freedesktop.Avahi.Server, path=/, member=ServiceResolverNew
dbus-protocol.c: interface=org.freedesktop.Avahi.Server, path=/, member=ServiceResolverNew
dbus-protocol.c: interface=org.freedesktop.Avahi.Server, path=/, member=ServiceResolverNew
dbus-protocol.c: interface=org.freedesktop.Avahi.Server, path=/, member=ServiceResolverNew
dbus-protocol.c: interface=org.freedesktop.Avahi.Server, path=/, member=ServiceResolverNew
dbus-protocol.c: interface=org.freedesktop.Avahi.Server, path=/, member=ServiceResolverNew
dbus-protocol.c: interface=org.freedesktop.Avahi.Server, path=/, member=ServiceResolverNew
dbus-protocol.c: interface=org.freedesktop.Avahi.Server, path=/, member=ServiceResolverNew
dbus-protocol.c: interface=org.freedesktop.Avahi.Server, path=/, member=ServiceResolverNew
dbus-protocol.c: interface=org.freedesktop.Avahi.Server, path=/, member=ServiceResolverNew
dbus-protocol.c: interface=org.freedesktop.Avahi.Server, path=/, member=ServiceResolverNew
dbus-protocol.c: interface=org.freedesktop.Avahi.Server, path=/, member=ServiceResolverNew
dbus-protocol.c: interface=org.freedesktop.Avahi.Server, path=/, member=ServiceResolverNew
dbus-protocol.c: interface=org.freedesktop.Avahi.Server, path=/, member=ServiceResolverNew
dbus-protocol.c: interface=org.freedesktop.Avahi.Server, path=/, member=ServiceResolverNew
dbus-protocol.c: interface=org.freedesktop.Avahi.Server, path=/, member=ServiceResolverNew
dbus-protocol.c: interface=org.freedesktop.Avahi.Server, path=/, member=ServiceResolverNew
dbus-protocol.c: interface=org.freedesktop.Avahi.Server, path=/, member=ServiceResolverNew
dbus-protocol.c: interface=org.freedesktop.Avahi.Server, path=/, member=ServiceResolverNew
dbus-protocol.c: interface=org.freedesktop.Avahi.Server, path=/, member=ServiceResolverNew
dbus-protocol.c: interface=org.freedesktop.Avahi.Server, path=/, member=ServiceResolverNew
dbus-protocol.c: interface=org.freedesktop.Avahi.Server, path=/, member=ServiceResolverNew
dbus-protocol.c: interface=org.freedesktop.Avahi.Server, path=/, member=ServiceResolverNew
dbus-protocol.c: interface=org.freedesktop.Avahi.Server, path=/, member=ServiceResolverNew
dbus-protocol.c: interface=org.freedesktop.Avahi.Server, path=/, member=ServiceResolverNew
dbus-protocol.c: interface=org.freedesktop.Avahi.Server, path=/, member=ServiceResolverNew
dbus-protocol.c: interface=org.freedesktop.Avahi.Server, path=/, member=ServiceResolverNew
dbus-protocol.c: interface=org.freedesktop.Avahi.Server, path=/, member=ServiceResolverNew
dbus-protocol.c: interface=org.freedesktop.Avahi.Server, path=/, member=ServiceResolverNew
dbus-protocol.c: interface=org.freedesktop.Avahi.Server, path=/, member=ServiceResolverNew
dbus-protocol.c: interface=org.freedesktop.Avahi.Server, path=/, member=ServiceResolverNew
dbus-protocol.c: interface=org.freedesktop.Avahi.Server, path=/, member=ServiceResolverNew
dbus-protocol.c: interface=org.freedesktop.Avahi.Server, path=/, member=ServiceResolverNew
dbus-protocol.c: interface=org.freedesktop.Avahi.Server, path=/, member=ServiceResolverNew
dbus-protocol.c: interface=org.freedesktop.Avahi.Server, path=/, member=ServiceResolverNew
dbus-protocol.c: interface=org.freedesktop.Avahi.Server, path=/, member=ServiceResolverNew
dbus-protocol.c: interface=org.freedesktop.Avahi.Server, path=/, member=ServiceResolverNew
dbus-protocol.c: interface=org.freedesktop.Avahi.Server, path=/, member=ServiceResolverNew
dbus-protocol.c: interface=org.freedesktop.Avahi.Server, path=/, member=ServiceResolverNew
dbus-protocol.c: interface=org.freedesktop.Avahi.Server, path=/, member=ServiceResolverNew
dbus-protocol.c: interface=org.freedesktop.Avahi.Server, path=/, member=ServiceResolverNew
dbus-protocol.c: interface=org.freedesktop.Avahi.Server, path=/, member=ServiceResolverNew
dbus-protocol.c: interface=org.freedesktop.Avahi.Server, path=/, member=ServiceResolverNew
dbus-protocol.c: interface=org.freedesktop.Avahi.Server, path=/, member=ServiceResolverNew
dbus-protocol.c: interface=org.freedesktop.Avahi.Server, path=/, member=ServiceResolverNew
dbus-protocol.c: interface=org.freedesktop.Avahi.Server, path=/, member=ServiceResolverNew
dbus-protocol.c: interface=org.freedesktop.Avahi.Server, path=/, member=ServiceResolverNew
dbus-protocol.c: interface=org.freedesktop.Avahi.Server, path=/, member=ServiceResolverNew
dbus-protocol.c: interface=org.freedesktop.Avahi.Server, path=/, member=ServiceResolverNew
dbus-protocol.c: interface=org.freedesktop.Avahi.Server, path=/, member=ServiceResolverNew
dbus-protocol.c: interface=org.freedesktop.Avahi.Server, path=/, member=ServiceResolverNew
dbus-protocol.c: interface=org.freedesktop.Avahi.Server, path=/, member=ServiceResolverNew
dbus-protocol.c: interface=org.freedesktop.Avahi.Server, path=/, member=ServiceResolverNew
dbus-protocol.c: interface=org.freedesktop.Avahi.Server, path=/, member=ServiceResolverNew
dbus-protocol.c: interface=org.freedesktop.Avahi.Server, path=/, member=ServiceResolverNew
dbus-protocol.c: interface=org.freedesktop.Avahi.Server, path=/, member=ServiceResolverNew
dbus-protocol.c: interface=org.freedesktop.Avahi.Server, path=/, member=ServiceResolverNew
dbus-protocol.c: interface=org.freedesktop.Avahi.Server, path=/, member=ServiceResolverNew
dbus-protocol.c: interface=org.freedesktop.Avahi.Server, path=/, member=ServiceResolverNew
dbus-protocol.c: interface=org.freedesktop.Avahi.Server, path=/, member=ServiceResolverNew
dbus-protocol.c: interface=org.freedesktop.Avahi.Server, path=/, member=ServiceResolverNew
dbus-protocol.c: interface=org.freedesktop.Avahi.Server, path=/, member=ServiceResolverNew
dbus-protocol.c: interface=org.freedesktop.Avahi.Server, path=/, member=ServiceResolverNew
dbus-async-service-resolver.c: interface=org.freedesktop.Avahi.ServiceResolver, path=/Client0/ServiceResolver2, member=Free
dbus-async-service-resolver.c: interface=org.freedesktop.Avahi.ServiceResolver, path=/Client0/ServiceResolver3, member=Free
dbus-async-service-resolver.c: interface=org.freedesktop.Avahi.ServiceResolver, path=/Client0/ServiceResolver4, member=Free
dbus-async-service-resolver.c: interface=org.freedesktop.Avahi.ServiceResolver, path=/Client0/ServiceResolver5, member=Free
dbus-async-service-resolver.c: interface=org.freedesktop.Avahi.ServiceResolver, path=/Client0/ServiceResolver6, member=Free
dbus-async-service-resolver.c: interface=org.freedesktop.Avahi.ServiceResolver, path=/Client0/ServiceResolver7, member=Free
dbus-async-service-resolver.c: interface=org.freedesktop.Avahi.ServiceResolver, path=/Client0/ServiceResolver8, member=Free
dbus-async-service-resolver.c: interface=org.freedesktop.Avahi.ServiceResolver, path=/Client0/ServiceResolver9, member=Free
dbus-async-service-resolver.c: interface=org.freedesktop.Avahi.ServiceResolver, path=/Client0/ServiceResolver10, member=Free
dbus-async-service-resolver.c: interface=org.freedesktop.Avahi.ServiceResolver, path=/Client0/ServiceResolver11, member=Free
dbus-async-service-resolver.c: interface=org.freedesktop.Avahi.ServiceResolver, path=/Client0/ServiceResolver12, member=Free
dbus-async-service-resolver.c: interface=org.freedesktop.Avahi.ServiceResolver, path=/Client0/ServiceResolver13, member=Free
dbus-async-service-resolver.c: interface=org.freedesktop.Avahi.ServiceResolver, path=/Client0/ServiceResolver14, member=Free
dbus-async-service-resolver.c: interface=org.freedesktop.Avahi.ServiceResolver, path=/Client0/ServiceResolver15, member=Free
dbus-async-service-resolver.c: interface=org.freedesktop.Avahi.ServiceResolver, path=/Client0/ServiceResolver16, member=Free
dbus-async-service-resolver.c: interface=org.freedesktop.Avahi.ServiceResolver, path=/Client0/ServiceResolver17, member=Free
dbus-async-service-resolver.c: interface=org.freedesktop.Avahi.ServiceResolver, path=/Client0/ServiceResolver18, member=Free
dbus-async-service-resolver.c: interface=org.freedesktop.Avahi.ServiceResolver, path=/Client0/ServiceResolver19, member=Free
dbus-async-service-resolver.c: interface=org.freedesktop.Avahi.ServiceResolver, path=/Client0/ServiceResolver20, member=Free
dbus-async-service-resolver.c: interface=org.freedesktop.Avahi.ServiceResolver, path=/Client0/ServiceResolver21, member=Free
dbus-async-service-resolver.c: interface=org.freedesktop.Avahi.ServiceResolver, path=/Client0/ServiceResolver22, member=Free
dbus-async-service-resolver.c: interface=org.freedesktop.Avahi.ServiceResolver, path=/Client0/ServiceResolver23, member=Free
dbus-async-service-resolver.c: interface=org.freedesktop.Avahi.ServiceResolver, path=/Client0/ServiceResolver24, member=Free
dbus-async-service-resolver.c: interface=org.freedesktop.Avahi.ServiceResolver, path=/Client0/ServiceResolver25, member=Free
dbus-async-service-resolver.c: interface=org.freedesktop.Avahi.ServiceResolver, path=/Client0/ServiceResolver26, member=Free
dbus-async-service-resolver.c: interface=org.freedesktop.Avahi.ServiceResolver, path=/Client0/ServiceResolver27, member=Free
dbus-async-service-resolver.c: interface=org.freedesktop.Avahi.ServiceResolver, path=/Client0/ServiceResolver28, member=Free
dbus-async-service-resolver.c: interface=org.freedesktop.Avahi.ServiceResolver, path=/Client0/ServiceResolver29, member=Free
dbus-async-service-resolver.c: interface=org.freedesktop.Avahi.ServiceResolver, path=/Client0/ServiceResolver30, member=Free
dbus-async-service-resolver.c: interface=org.freedesktop.Avahi.ServiceResolver, path=/Client0/ServiceResolver31, member=Free
dbus-async-service-resolver.c: interface=org.freedesktop.Avahi.ServiceResolver, path=/Client0/ServiceResolver32, member=Free
dbus-async-service-resolver.c: interface=org.freedesktop.Avahi.ServiceResolver, path=/Client0/ServiceResolver33, member=Free
dbus-async-service-resolver.c: interface=org.freedesktop.Avahi.ServiceResolver, path=/Client0/ServiceResolver34, member=Free
dbus-async-service-resolver.c: interface=org.freedesktop.Avahi.ServiceResolver, path=/Client0/ServiceResolver35, member=Free
dbus-async-service-resolver.c: interface=org.freedesktop.Avahi.ServiceResolver, path=/Client0/ServiceResolver36, member=Free
dbus-async-service-resolver.c: interface=org.freedesktop.Avahi.ServiceResolver, path=/Client0/ServiceResolver37, member=Free
dbus-async-service-resolver.c: interface=org.freedesktop.Avahi.ServiceResolver, path=/Client0/ServiceResolver38, member=Free
dbus-async-service-resolver.c: interface=org.freedesktop.Avahi.ServiceResolver, path=/Client0/ServiceResolver39, member=Free
dbus-async-service-resolver.c: interface=org.freedesktop.Avahi.ServiceResolver, path=/Client0/ServiceResolver40, member=Free
dbus-async-service-resolver.c: interface=org.freedesktop.Avahi.ServiceResolver, path=/Client0/ServiceResolver41, member=Free
dbus-async-service-resolver.c: interface=org.freedesktop.Avahi.ServiceResolver, path=/Client0/ServiceResolver42, member=Free
dbus-async-service-resolver.c: interface=org.freedesktop.Avahi.ServiceResolver, path=/Client0/ServiceResolver43, member=Free
dbus-async-service-resolver.c: interface=org.freedesktop.Avahi.ServiceResolver, path=/Client0/ServiceResolver44, member=Free
dbus-async-service-resolver.c: interface=org.freedesktop.Avahi.ServiceResolver, path=/Client0/ServiceResolver45, member=Free
dbus-async-service-resolver.c: interface=org.freedesktop.Avahi.ServiceResolver, path=/Client0/ServiceResolver46, member=Free
dbus-async-service-resolver.c: interface=org.freedesktop.Avahi.ServiceResolver, path=/Client0/ServiceResolver47, member=Free
dbus-async-service-resolver.c: interface=org.freedesktop.Avahi.ServiceResolver, path=/Client0/ServiceResolver48, member=Free
dbus-async-service-resolver.c: interface=org.freedesktop.Avahi.ServiceResolver, path=/Client0/ServiceResolver49, member=Free
dbus-async-service-resolver.c: interface=org.freedesktop.Avahi.ServiceResolver, path=/Client0/ServiceResolver50, member=Free
dbus-async-service-resolver.c: interface=org.freedesktop.Avahi.ServiceResolver, path=/Client0/ServiceResolver51, member=Free
dbus-async-service-resolver.c: interface=org.freedesktop.Avahi.ServiceResolver, path=/Client0/ServiceResolver52, member=Free
dbus-async-service-resolver.c: interface=org.freedesktop.Avahi.ServiceResolver, path=/Client0/ServiceResolver53, member=Free
dbus-async-service-resolver.c: interface=org.freedesktop.Avahi.ServiceResolver, path=/Client0/ServiceResolver54, member=Free
dbus-async-service-resolver.c: interface=org.freedesktop.Avahi.ServiceResolver, path=/Client0/ServiceResolver55, member=Free
dbus-async-service-resolver.c: interface=org.freedesktop.Avahi.ServiceResolver, path=/Client0/ServiceResolver56, member=Free
dbus-async-service-resolver.c: interface=org.freedesktop.Avahi.ServiceResolver, path=/Client0/ServiceResolver57, member=Free
dbus-async-service-resolver.c: interface=org.freedesktop.Avahi.ServiceResolver, path=/Client0/ServiceResolver58, member=Free
dbus-async-service-resolver.c: interface=org.freedesktop.Avahi.ServiceResolver, path=/Client0/ServiceResolver59, member=Free
dbus-async-service-resolver.c: interface=org.freedesktop.Avahi.ServiceResolver, path=/Client0/ServiceResolver60, member=Free
dbus-async-service-resolver.c: interface=org.freedesktop.Avahi.ServiceResolver, path=/Client0/ServiceResolver61, member=Free
dbus-async-service-resolver.c: interface=org.freedesktop.Avahi.ServiceResolver, path=/Client0/ServiceResolver62, member=Free
dbus-async-service-resolver.c: interface=org.freedesktop.Avahi.ServiceResolver, path=/Client0/ServiceResolver63, member=Free
dbus-async-service-resolver.c: interface=org.freedesktop.Avahi.ServiceResolver, path=/Client0/ServiceResolver64, member=Free
dbus-async-service-resolver.c: interface=org.freedesktop.Avahi.ServiceResolver, path=/Client0/ServiceResolver65, member=Free
dbus-async-service-resolver.c: interface=org.freedesktop.Avahi.ServiceResolver, path=/Client0/ServiceResolver66, member=Free
dbus-async-service-resolver.c: interface=org.freedesktop.Avahi.ServiceResolver, path=/Client0/ServiceResolver67, member=Free
dbus-async-service-resolver.c: interface=org.freedesktop.Avahi.ServiceResolver, path=/Client0/ServiceResolver68, member=Free
dbus-async-service-resolver.c: interface=org.freedesktop.Avahi.ServiceResolver, path=/Client0/ServiceResolver69, member=Free
dbus-async-service-resolver.c: interface=org.freedesktop.Avahi.ServiceResolver, path=/Client0/ServiceResolver70, member=Free
dbus-async-service-resolver.c: interface=org.freedesktop.Avahi.ServiceResolver, path=/Client0/ServiceResolver71, member=Free
dbus-async-service-resolver.c: interface=org.freedesktop.Avahi.ServiceResolver, path=/Client0/ServiceResolver72, member=Free
dbus-async-service-resolver.c: interface=org.freedesktop.Avahi.ServiceResolver, path=/Client0/ServiceResolver73, member=Free
dbus-async-service-resolver.c: interface=org.freedesktop.Avahi.ServiceResolver, path=/Client0/ServiceResolver74, member=Free
dbus-async-service-resolver.c: interface=org.freedesktop.Avahi.ServiceResolver, path=/Client0/ServiceResolver75, member=Free
dbus-async-service-resolver.c: interface=org.freedesktop.Avahi.ServiceResolver, path=/Client0/ServiceResolver76, member=Free
dbus-async-service-resolver.c: interface=org.freedesktop.Avahi.ServiceResolver, path=/Client0/ServiceResolver77, member=Free
dbus-async-service-resolver.c: interface=org.freedesktop.Avahi.ServiceResolver, path=/Client0/ServiceResolver78, member=Free
dbus-async-service-resolver.c: interface=org.freedesktop.Avahi.ServiceResolver, path=/Client0/ServiceResolver79, member=Free
dbus-async-service-resolver.c: interface=org.freedesktop.Avahi.ServiceResolver, path=/Client0/ServiceResolver80, member=Free
dbus-async-service-resolver.c: interface=org.freedesktop.Avahi.ServiceResolver, path=/Client0/ServiceResolver81, member=Free
dbus-async-service-resolver.c: interface=org.freedesktop.Avahi.ServiceResolver, path=/Client0/ServiceResolver82, member=Free
dbus-async-service-resolver.c: interface=org.freedesktop.Avahi.ServiceResolver, path=/Client0/ServiceResolver83, member=Free
dbus-async-service-resolver.c: interface=org.freedesktop.Avahi.ServiceResolver, path=/Client0/ServiceResolver84, member=Free
dbus-async-service-resolver.c: interface=org.freedesktop.Avahi.ServiceResolver, path=/Client0/ServiceResolver85, member=Free
dbus-async-service-resolver.c: interface=org.freedesktop.Avahi.ServiceResolver, path=/Client0/ServiceResolver86, member=Free
dbus-async-service-resolver.c: interface=org.freedesktop.Avahi.ServiceResolver, path=/Client0/ServiceResolver87, member=Free
dbus-async-service-resolver.c: interface=org.freedesktop.Avahi.ServiceResolver, path=/Client0/ServiceResolver88, member=Free
dbus-async-service-resolver.c: interface=org.freedesktop.Avahi.ServiceResolver, path=/Client0/ServiceResolver89, member=Free
dbus-async-service-resolver.c: interface=org.freedesktop.Avahi.ServiceResolver, path=/Client0/ServiceResolver90, member=Free
dbus-async-service-resolver.c: interface=org.freedesktop.Avahi.ServiceResolver, path=/Client0/ServiceResolver91, member=Free
dbus-async-service-resolver.c: interface=org.freedesktop.Avahi.ServiceResolver, path=/Client0/ServiceResolver92, member=Free
dbus-async-service-resolver.c: interface=org.freedesktop.Avahi.ServiceResolver, path=/Client0/ServiceResolver93, member=Free
dbus-async-service-resolver.c: interface=org.freedesktop.Avahi.ServiceResolver, path=/Client0/ServiceResolver94, member=Free
dbus-async-service-resolver.c: interface=org.freedesktop.Avahi.ServiceResolver, path=/Client0/ServiceResolver95, member=Free
dbus-async-service-resolver.c: interface=org.freedesktop.Avahi.ServiceResolver, path=/Client0/ServiceResolver96, member=Free
dbus-async-service-resolver.c: interface=org.freedesktop.Avahi.ServiceResolver, path=/Client0/ServiceResolver97, member=Free
dbus-async-service-resolver.c: interface=org.freedesktop.Avahi.ServiceResolver, path=/Client0/ServiceResolver98, member=Free
dbus-async-service-resolver.c: interface=org.freedesktop.Avahi.ServiceResolver, path=/Client0/ServiceResolver99, member=Free
dbus-async-service-resolver.c: interface=org.freedesktop.Avahi.ServiceResolver, path=/Client0/ServiceResolver100, member=Free
dbus-async-service-resolver.c: interface=org.freedesktop.Avahi.ServiceResolver, path=/Client0/ServiceResolver101, member=Free
dbus-async-service-resolver.c: interface=org.freedesktop.Avahi.ServiceResolver, path=/Client0/ServiceResolver102, member=Free
dbus-async-service-resolver.c: interface=org.freedesktop.Avahi.ServiceResolver, path=/Client0/ServiceResolver103, member=Free
dbus-async-service-resolver.c: interface=org.freedesktop.Avahi.ServiceResolver, path=/Client0/ServiceResolver104, member=Free
dbus-async-service-resolver.c: interface=org.freedesktop.Avahi.ServiceResolver, path=/Client0/ServiceResolver105, member=Free
Record [_device_info._tcp.local IN      PTR test32._device_info._tcp.local ; ttl=4500] not fitting in legacy unicast packet, dropping.
Record [test32._device_info._tcp.local  IN      TXT  ; ttl=4500] not fitting in legacy unicast packet, dropping.
Record [test32._device_info._tcp.local  IN      SRV 0 0 32 nas.local ; ttl=120] not fitting in legacy unicast packet, dropping.
Record [_device_info._tcp.local IN      PTR test31._device_info._tcp.local ; ttl=4500] not fitting in legacy unicast packet, dropping.
Record [test31._device_info._tcp.local  IN      TXT  ; ttl=4500] not fitting in legacy unicast packet, dropping.
Record [test31._device_info._tcp.local  IN      SRV 0 0 31 nas.local ; ttl=120] not fitting in legacy unicast packet, dropping.
Record [_device_info._tcp.local IN      PTR test30._device_info._tcp.local ; ttl=4500] not fitting in legacy unicast packet, dropping.
Record [test30._device_info._tcp.local  IN      TXT  ; ttl=4500] not fitting in legacy unicast packet, dropping.
Record [test30._device_info._tcp.local  IN      SRV 0 0 30 nas.local ; ttl=120] not fitting in legacy unicast packet, dropping.
Record [_device_info._tcp.local IN      PTR test29._device_info._tcp.local ; ttl=4500] not fitting in legacy unicast packet, dropping.
Record [test29._device_info._tcp.local  IN      TXT  ; ttl=4500] not fitting in legacy unicast packet, dropping.
Record [test29._device_info._tcp.local  IN      SRV 0 0 29 nas.local ; ttl=120] not fitting in legacy unicast packet, dropping.
Record [_device_info._tcp.local IN      PTR test28._device_info._tcp.local ; ttl=4500] not fitting in legacy unicast packet, dropping.
Record [test28._device_info._tcp.local  IN      TXT  ; ttl=4500] not fitting in legacy unicast packet, dropping.
Record [test28._device_info._tcp.local  IN      SRV 0 0 28 nas.local ; ttl=120] not fitting in legacy unicast packet, dropping.
Record [_device_info._tcp.local IN      PTR test27._device_info._tcp.local ; ttl=4500] not fitting in legacy unicast packet, dropping.
Record [test27._device_info._tcp.local  IN      TXT  ; ttl=4500] not fitting in legacy unicast packet, dropping.
Record [test27._device_info._tcp.local  IN      SRV 0 0 27 nas.local ; ttl=120] not fitting in legacy unicast packet, dropping.
Record [_device_info._tcp.local IN      PTR test26._device_info._tcp.local ; ttl=4500] not fitting in legacy unicast packet, dropping.
Record [test26._device_info._tcp.local  IN      TXT  ; ttl=4500] not fitting in legacy unicast packet, dropping.
Record [test26._device_info._tcp.local  IN      SRV 0 0 26 nas.local ; ttl=120] not fitting in legacy unicast packet, dropping.
Record [_device_info._tcp.local IN      PTR test25._device_info._tcp.local ; ttl=4500] not fitting in legacy unicast packet, dropping.
Record [test25._device_info._tcp.local  IN      TXT  ; ttl=4500] not fitting in legacy unicast packet, dropping.
Record [test25._device_info._tcp.local  IN      SRV 0 0 25 nas.local ; ttl=120] not fitting in legacy unicast packet, dropping.
Record [_device_info._tcp.local IN      PTR test24._device_info._tcp.local ; ttl=4500] not fitting in legacy unicast packet, dropping.
Record [test24._device_info._tcp.local  IN      TXT  ; ttl=4500] not fitting in legacy unicast packet, dropping.
Record [test24._device_info._tcp.local  IN      SRV 0 0 24 nas.local ; ttl=120] not fitting in legacy unicast packet, dropping.
Record [_device_info._tcp.local IN      PTR test23._device_info._tcp.local ; ttl=4500] not fitting in legacy unicast packet, dropping.
Record [test23._device_info._tcp.local  IN      TXT  ; ttl=4500] not fitting in legacy unicast packet, dropping.
Record [test23._device_info._tcp.local  IN      SRV 0 0 23 nas.local ; ttl=120] not fitting in legacy unicast packet, dropping.
Record [_device_info._tcp.local IN      PTR test22._device_info._tcp.local ; ttl=4500] not fitting in legacy unicast packet, dropping.
Record [test22._device_info._tcp.local  IN      TXT  ; ttl=4500] not fitting in legacy unicast packet, dropping.
Record [test22._device_info._tcp.local  IN      SRV 0 0 22 nas.local ; ttl=120] not fitting in legacy unicast packet, dropping.
Record [_device_info._tcp.local IN      PTR test21._device_info._tcp.local ; ttl=4500] not fitting in legacy unicast packet, dropping.
Record [test21._device_info._tcp.local  IN      TXT  ; ttl=4500] not fitting in legacy unicast packet, dropping.
Record [test21._device_info._tcp.local  IN      SRV 0 0 21 nas.local ; ttl=120] not fitting in legacy unicast packet, dropping.
Record [_device_info._tcp.local IN      PTR test20._device_info._tcp.local ; ttl=4500] not fitting in legacy unicast packet, dropping.
Record [test20._device_info._tcp.local  IN      TXT  ; ttl=4500] not fitting in legacy unicast packet, dropping.
Record [test20._device_info._tcp.local  IN      SRV 0 0 20 nas.local ; ttl=120] not fitting in legacy unicast packet, dropping.
Record [_device_info._tcp.local IN      PTR test19._device_info._tcp.local ; ttl=4500] not fitting in legacy unicast packet, dropping.
Record [test19._device_info._tcp.local  IN      TXT  ; ttl=4500] not fitting in legacy unicast packet, dropping.
Record [test19._device_info._tcp.local  IN      SRV 0 0 19 nas.local ; ttl=120] not fitting in legacy unicast packet, dropping.
Record [_device_info._tcp.local IN      PTR test18._device_info._tcp.local ; ttl=4500] not fitting in legacy unicast packet, dropping.
Record [test18._device_info._tcp.local  IN      TXT  ; ttl=4500] not fitting in legacy unicast packet, dropping.
Record [test18._device_info._tcp.local  IN      SRV 0 0 18 nas.local ; ttl=120] not fitting in legacy unicast packet, dropping.
Record [_device_info._tcp.local IN      PTR test17._device_info._tcp.local ; ttl=4500] not fitting in legacy unicast packet, dropping.
Record [test17._device_info._tcp.local  IN      TXT  ; ttl=4500] not fitting in legacy unicast packet, dropping.
Record [test17._device_info._tcp.local  IN      SRV 0 0 17 nas.local ; ttl=120] not fitting in legacy unicast packet, dropping.
Record [_device_info._tcp.local IN      PTR test16._device_info._tcp.local ; ttl=4500] not fitting in legacy unicast packet, dropping.
Record [test16._device_info._tcp.local  IN      TXT  ; ttl=4500] not fitting in legacy unicast packet, dropping.
Record [test16._device_info._tcp.local  IN      SRV 0 0 16 nas.local ; ttl=120] not fitting in legacy unicast packet, dropping.
Record [_device_info._tcp.local IN      PTR test15._device_info._tcp.local ; ttl=4500] not fitting in legacy unicast packet, dropping.
Record [test15._device_info._tcp.local  IN      TXT  ; ttl=4500] not fitting in legacy unicast packet, dropping.
Record [test15._device_info._tcp.local  IN      SRV 0 0 15 nas.local ; ttl=120] not fitting in legacy unicast packet, dropping.
Record [_device_info._tcp.local IN      PTR test14._device_info._tcp.local ; ttl=4500] not fitting in legacy unicast packet, dropping.
Record [test14._device_info._tcp.local  IN      TXT  ; ttl=4500] not fitting in legacy unicast packet, dropping.
Record [test14._device_info._tcp.local  IN      SRV 0 0 14 nas.local ; ttl=120] not fitting in legacy unicast packet, dropping.
Record [_device_info._tcp.local IN      PTR test13._device_info._tcp.local ; ttl=4500] not fitting in legacy unicast packet, dropping.
Record [test13._device_info._tcp.local  IN      TXT  ; ttl=4500] not fitting in legacy unicast packet, dropping.
Record [test13._device_info._tcp.local  IN      SRV 0 0 13 nas.local ; ttl=120] not fitting in legacy unicast packet, dropping.
Record [_device_info._tcp.local IN      PTR test12._device_info._tcp.local ; ttl=4500] not fitting in legacy unicast packet, dropping.
Record [test12._device_info._tcp.local  IN      TXT  ; ttl=4500] not fitting in legacy unicast packet, dropping.
Record [test12._device_info._tcp.local  IN      SRV 0 0 12 nas.local ; ttl=120] not fitting in legacy unicast packet, dropping.
Record [_device_info._tcp.local IN      PTR test11._device_info._tcp.local ; ttl=4500] not fitting in legacy unicast packet, dropping.
Record [test11._device_info._tcp.local  IN      TXT  ; ttl=4500] not fitting in legacy unicast packet, dropping.
Record [test11._device_info._tcp.local  IN      SRV 0 0 11 nas.local ; ttl=120] not fitting in legacy unicast packet, dropping.
Record [_device_info._tcp.local IN      PTR test10._device_info._tcp.local ; ttl=4500] not fitting in legacy unicast packet, dropping.
Record [test10._device_info._tcp.local  IN      TXT  ; ttl=4500] not fitting in legacy unicast packet, dropping.
Record [test10._device_info._tcp.local  IN      SRV 0 0 10 nas.local ; ttl=120] not fitting in legacy unicast packet, dropping.
Record [_device_info._tcp.local IN      PTR test09._device_info._tcp.local ; ttl=4500] not fitting in legacy unicast packet, dropping.
Record [test09._device_info._tcp.local  IN      TXT  ; ttl=4500] not fitting in legacy unicast packet, dropping.
Record [test09._device_info._tcp.local  IN      SRV 0 0 9 nas.local ; ttl=120] not fitting in legacy unicast packet, dropping.
Record [_device_info._tcp.local IN      PTR test08._device_info._tcp.local ; ttl=4500] not fitting in legacy unicast packet, dropping.
Record [test08._device_info._tcp.local  IN      TXT  ; ttl=4500] not fitting in legacy unicast packet, dropping.
Record [test08._device_info._tcp.local  IN      SRV 0 0 8 nas.local ; ttl=120] not fitting in legacy unicast packet, dropping.
Record [_device_info._tcp.local IN      PTR test07._device_info._tcp.local ; ttl=4500] not fitting in legacy unicast packet, dropping.
Record [test07._device_info._tcp.local  IN      TXT  ; ttl=4500] not fitting in legacy unicast packet, dropping.
Record [test07._device_info._tcp.local  IN      SRV 0 0 7 nas.local ; ttl=120] not fitting in legacy unicast packet, dropping.
Record [_device_info._tcp.local IN      PTR test06._device_info._tcp.local ; ttl=4500] not fitting in legacy unicast packet, dropping.
Record [test06._device_info._tcp.local  IN      TXT  ; ttl=4500] not fitting in legacy unicast packet, dropping.
Record [test06._device_info._tcp.local  IN      SRV 0 0 6 nas.local ; ttl=120] not fitting in legacy unicast packet, dropping.
Record [_device_info._tcp.local IN      PTR test05._device_info._tcp.local ; ttl=4500] not fitting in legacy unicast packet, dropping.
Record [test05._device_info._tcp.local  IN      TXT  ; ttl=4500] not fitting in legacy unicast packet, dropping.
Record [test05._device_info._tcp.local  IN      SRV 0 0 5 nas.local ; ttl=120] not fitting in legacy unicast packet, dropping.
Record [_device_info._tcp.local IN      PTR test04._device_info._tcp.local ; ttl=4500] not fitting in legacy unicast packet, dropping.
Record [test04._device_info._tcp.local  IN      TXT  ; ttl=4500] not fitting in legacy unicast packet, dropping.
Record [test04._device_info._tcp.local  IN      SRV 0 0 4 nas.local ; ttl=120] not fitting in legacy unicast packet, dropping.
Record [_device_info._tcp.local IN      PTR test03._device_info._tcp.local ; ttl=4500] not fitting in legacy unicast packet, dropping.
Record [test03._device_info._tcp.local  IN      TXT  ; ttl=4500] not fitting in legacy unicast packet, dropping.
Record [test03._device_info._tcp.local  IN      SRV 0 0 3 nas.local ; ttl=120] not fitting in legacy unicast packet, dropping.
Record [_device_info._tcp.local IN      PTR test02._device_info._tcp.local ; ttl=4500] not fitting in legacy unicast packet, dropping.
Record [test02._device_info._tcp.local  IN      TXT  ; ttl=4500] not fitting in legacy unicast packet, dropping.
Record [test02._device_info._tcp.local  IN      SRV 0 0 2 nas.local ; ttl=120] not fitting in legacy unicast packet, dropping.
Record [_device_info._tcp.local IN      PTR test01._device_info._tcp.local ; ttl=4500] not fitting in legacy unicast packet, dropping.
Record [test01._device_info._tcp.local  IN      TXT  ; ttl=4500] not fitting in legacy unicast packet, dropping.
Record [test01._device_info._tcp.local  IN      SRV 0 0 1 nas.local ; ttl=120] not fitting in legacy unicast packet, dropping.
dbus-async-service-resolver.c: interface=org.freedesktop.Avahi.ServiceResolver, path=/Client0/ServiceResolver106, member=Free
dbus-async-service-resolver.c: interface=org.freedesktop.Avahi.ServiceResolver, path=/Client0/ServiceResolver107, member=Free
dbus-async-service-resolver.c: interface=org.freedesktop.Avahi.ServiceResolver, path=/Client0/ServiceResolver108, member=Free
dbus-async-service-resolver.c: interface=org.freedesktop.Avahi.ServiceResolver, path=/Client0/ServiceResolver109, member=Free
dbus-async-service-resolver.c: interface=org.freedesktop.Avahi.ServiceResolver, path=/Client0/ServiceResolver110, member=Free
dbus-async-service-resolver.c: interface=org.freedesktop.Avahi.ServiceResolver, path=/Client0/ServiceResolver111, member=Free
dbus-async-service-resolver.c: interface=org.freedesktop.Avahi.ServiceResolver, path=/Client0/ServiceResolver112, member=Free
dbus-async-service-resolver.c: interface=org.freedesktop.Avahi.ServiceResolver, path=/Client0/ServiceResolver113, member=Free
dbus-async-service-resolver.c: interface=org.freedesktop.Avahi.ServiceResolver, path=/Client0/ServiceResolver114, member=Free
dbus-async-service-resolver.c: interface=org.freedesktop.Avahi.ServiceResolver, path=/Client0/ServiceResolver115, member=Free
dbus-async-service-resolver.c: interface=org.freedesktop.Avahi.ServiceResolver, path=/Client0/ServiceResolver116, member=Free
dbus-async-service-resolver.c: interface=org.freedesktop.Avahi.ServiceResolver, path=/Client0/ServiceResolver117, member=Free
dbus-async-service-resolver.c: interface=org.freedesktop.Avahi.ServiceResolver, path=/Client0/ServiceResolver118, member=Free
dbus-async-service-resolver.c: interface=org.freedesktop.Avahi.ServiceResolver, path=/Client0/ServiceResolver119, member=Free
dbus-async-service-resolver.c: interface=org.freedesktop.Avahi.ServiceResolver, path=/Client0/ServiceResolver120, member=Free
dbus-async-service-resolver.c: interface=org.freedesktop.Avahi.ServiceResolver, path=/Client0/ServiceResolver121, member=Free
dbus-protocol.c: client :1.3271 vanished.
```

No difference with `--no-rlimits --no-drop-root --no-chroot --no-proc-title`.

```
/dev/shm/empty#  ulimit -a
-t: cpu time (seconds)              unlimited
-f: file size (blocks)              unlimited
-d: data seg size (kbytes)          unlimited
-s: stack size (kbytes)             unlimited
-c: core file size (blocks)         262144
-m: resident set size (kbytes)      unlimited
-u: processes                       4096
-n: file descriptors                524288
-l: locked-in-memory size (kbytes)  8192
-v: address space (kbytes)          unlimited
-x: file locks                      unlimited
-i: pending signals                 515350
-q: bytes in POSIX msg queues       819200
-e: max nice                        0
-r: max rt priority                 0
-N 15: rt cpu time (microseconds)   unlimited
/dev/shm/empty#  rpm -qf /usr/lib64/libdaemon.so.0 /usr/lib64/libexpat.so.1 /lib64/libcap.so.2 /usr/lib64/libdbus-1.so.3 /lib64/libc.so.6 /lib64/libsystemd.so.0 /lib64/ld-linux-x86-64.so.2 /lib64/libgcrypt.so.20 /lib64/liblzma.so.5 /lib64/libzstd.so.1 /lib64/liblz4.so.1 /lib64/libgpg-error.so.0
libdaemon-0.14-2.x86_64 <= old, but newest available...
expat-2.2.0-4.x86_64 <= old, XML parser
libcap-libs-2.66-1-th.x86_64
dbus-libs-1.14.4-1-th.x86_64
glibc-2.38-7-th.x86_64
systemd-libs-252.1-1-th.x86_64
glibc-2.38-7-th.x86_64
libgcrypt-1.10.1-1-th.x86_64
xz-libs-X.X.X-1-th.x86_64
zstd-1.5.2-2-th.x86_64
lz4-libs-1.9.4-2-th.x86_64
libgpg-error-1.46-1-th.x86_64
```

**Comment by g0tar** [comment]
I've pinned this a little bit - with `lo`, `g1` and `g3` interfaces only nothing happens. But immediately after:

`ip link set dev w6 multicast on` these are logged:

```
Joining mDNS multicast group on interface w6.IPv4 with address A.B.6.9.
New relevant interface w6.IPv4 for mDNS.
Registering new address record for A.B.6.9 on w6.IPv4.
Invalid legacy unicast query packet.
Invalid legacy unicast query packet.
Invalid legacy unicast query packet.
Invalid legacy unicast query packet.
Received response from host A.B.6.9 with invalid source port 59406 on interface 'w6.0'
Invalid legacy unicast query packet.
Invalid legacy unicast query packet.
Invalid legacy unicast query packet.
Invalid legacy unicast query packet.
Invalid legacy unicast query packet.
Invalid legacy unicast query packet.
Invalid legacy unicast query packet.
Invalid legacy unicast query packet.
Received response from host A.B.6.9 with invalid source port 59406 on interface 'w6.0'
Received response from host A.B.6.9 with invalid source port 59406 on interface 'w6.0'
Received response from host A.B.6.9 with invalid source port 59406 on interface 'w6.0'
Received response from host A.B.6.9 with invalid source port 59406 on interface 'w6.0'
Received response from host A.B.6.9 with invalid source port 59406 on interface 'w6.0'
Received response from host A.B.6.9 with invalid source port 59406 on interface 'w6.0'
Received response from host A.B.6.9 with invalid source port 59406 on interface 'w6.0'
Received response from host A.B.6.9 with invalid source port 59406 on interface 'w6.0'
Received response from host A.B.6.9 with invalid source port 59406 on interface 'w6.0'
Received response from host A.B.6.9 with invalid source port 59406 on interface 'w6.0'
Received response from host A.B.6.9 with invalid source port 59406 on interface 'w6.0'
```

As you see this time it's different interface with those "bogus unicasts" (previously it was g1.0).

I haven't noticed that before, but previously logged `A.B.6.9 with invalid source port 24606 on interface 'g1.0'` are not supposed to be in `g1` interface at all! This address belongs to `w6` (being VLAN on different physical interface, g1 and g3 are also different physical ifaces). So this time - the source IP is valid, but still logged as invalid.

So - what generates these packets and why do they have non-interface source IP?

I've also removed `mdns4_minimal` from `nsswitch.conf` to make sure it's not some system resolver interference.

Therefore:
1. packets are logged as legacy unicasts, where in fact they are outgoing multicasts,
2. they require 40+ services and at least 3 of my interfaces,
3. the source IP is sometimes wrong, but even when hitting proper interface - still not handled properly.

The wrong source looks like different, unrelated bug.

**Comment by evverx** [comment]
> packets are logged as legacy unicasts, where in fact they are outgoing multicasts

avahi complains about legacy unicast responses it tries to send in response to those queries so the logs are correct. https://www.rfc-editor.org/rfc/rfc676 describes how those queries are supposed to be handled. It isn't clear where the queries come from (I can see probes and things like that but they should come from port 5353 if it's avahi). Can you try reproducing it on another machine with different hardware/kernel to see if it's reproducible there too?

**Comment by g0tar** [comment]
What makes you think they are supposed to originate from 5353? According to strace it's clear it's avahi sending them:

```
# strace -f -esendmsg ./usr/sbin/avahi-daemon -f /dev/null --debug
[...]
[pid 64584] sendmsg(11, {msg_name={sa_family=AF_INET, sin_port=htons(5353), sin_addr=inet_addr("224.0.0.251")}, msg_namelen=16, msg_iov=[{iov_base="\0\0\204\0\0\0\0\10\0\0\0\0\6test14\f_device_info"..., iov_len=188}], msg_iovlen=1, msg_control=[{cmsg_len=28, cmsg_level=SOL_IP, cmsg_type=IP_PKTINFO, cmsg_data={ipi_ifindex=if_nametoindex("w6"), ipi_spec_dst=inet_addr("A.B.6.9"), ipi_addr=inet_addr("0.0.0.0")}}], msg_controllen=28, msg_flags=0}, 0) = 188
[...]
# lsof -p 64584
[...]
avahi-dae 64584 avahi   11u     IPv4           37601922      0t0      UDP *:mdns
```

`sin_port` sets the destination port, apparently source is not being set properly (as it is not a **response** to inbound packet, but self-generated one).

**Comment by evverx** [comment]
> self-generated one in response for dbus query

The probe mentioned in the packet capture isn't related to D-Bus (or avahi-browse). Have you tried reproducing it on another machine?

**Comment by g0tar** [comment]
I've got reproducers (kernel 6.6.0 and 6.5.7)  and non-reproducer (5.4.0). The difference is source port in UDP packets sent... I've gone through `sysctl` settings and found nothing so far.

**Comment by evverx** [comment]
Do the machines where it's reproducible also send mDNS packets from port 5353 via those interfaces? Are their services visible to the other machines with `avahi-browse`?

**Comment by g0tar** [comment]
They send startup probes from non-5353 port, and their services are **partially** visible to other machines - only several got resolved, other (the ones being logged in as "incorrect unicast") return "timed out".

**Comment by g0tar** [comment]
I did some `nft` tracing and it seems to be something in conntrack - that could explain "delayed" effects of taking down interfaces and size of services required (determining number of packets).

**Comment by g0tar** [comment]
This is `type filter hook input`
```
udp dport 5353 udp sport != 5353 iif "g1" counter packets 30 bytes 16353
```

despite `tcpdump -Q in` not showing any packets. When I run several mcast interfaces, they all subscribe to 224.0.0.251 (`netstat -ng`) - including `lo` when I removed config file, and `lo` actually has shown incoming...
And since Linux disregards incoming multicast ifindex (subscriptions are per-system or maybe network namespace/VRF) distributing happily whatever is received to all receiving sockets, that took some weird path back into `avahi` (though NAT rules that should have not be applied to this traffic at all, but apparently were reachable).
When I got less interfaces and services, there were less packets and NAT opportunistically retained sport 5353, but as soon as the traffic increased this number was occupied and so the random ports... or something like this.

Therefore maybe:
1. `avahi` should [check received packets against list of subscribed interfaces](https://stackoverflow.com/questions/45922228/how-to-filter-a-multicast-receiving-socket-by-interface/46332571#46332571); 
Here https://github.com/avahi/avahi/blob/master/avahi-core/socket.c#L741?
3. The message https://github.com/avahi/avahi/blob/master/avahi-core/server.c#L985 should be adopted to match reality: *"Invalid legacy unicast query packet **or wrong source port**."*

Thanks for assistance, I think there's nothing to be done here except better debugging and accurate messages, so I'm closing.
