### ISSUE TITLE
Avahi Daemon Service Discovery Failure Due to Malformed Windows _dosvc._tcp.local. Service Names

### ISSUE THREAD

**Issue by echo-hi** [avahi/avahi#792]
**Avahi version**
0.8
**Distribution**
Ubuntu 24.04 LTS 
**Describe the bug**
When specific Windows hosts (10.10.34.28 and 10.10.34.105) broadcast _dosvc._tcp.local. services with same service names, same host name, Avahi enters a abnormal state. The daemon logs repeated avahi_normalize_name() and avahi_key_new() failures, causing service discovery to completely fail. DNSServiceBrowse() consistently returns error code -65537 while the daemon process continues running.

**To Reproduce**
connect to a network where several Windows hosts broadcast _dosvc._tcp.local. services (specifically with patterns like  hostname._dosvc._tcp.local.) , please specify same hostname 

Start avahi-daemon

Observe logs for repeated failures:
    avahi_normalize_name() failed 
    avahi_key_new() failed.

Attempt service discovery using DNSServiceBrowse or "avahi-browse -ar"
Service discovery will fail with error -65537
"avahi-browse -ar" will return some info and some service failed to resolve ( something like time out )

**Expected behavior**
Avahi should gracefully handle malformed service names

**Avahi config files if applicable**

**Avahi debug logs if applicable**
I add log to print service name in avahi_key_new like follow:
  avahi_log_error("avahi_normalize_name() failed name %s.",name);

it print like this:
**Additional context**
avahi-daemon 0.8 starting up.
No service file found in /etc/avahi/services.
Joining mDNS multicast group on interface enp0s31f6.IPv4 with address 10.10.34.29.
New relevant interface enp0s31f6.IPv4 for mDNS.
Network interface enumeration completed.
Registering new address record for fe80::56bf:64ff:fe7d:2fa5 on enp0s31f6.*.
Registering new address record for 10.10.34.29 on enp0s31f6.IPv4.
Server startup complete.
Host name is chenpeng-Precision-Tower-3620.local.
Local service cookie is 2136423298.
avahi_normalize_name() failed name 2E0N48E\04067\041\006_dosvc\004_tcp\005local\000\000\033\000\001\000\000\000x\000\029\000\000\000\000\030.
avahi_key_new() failed.
avahi_normalize_name() failed name E\04075\041\006_dosvc\004_tcp\005local\000\192\012\000\012\000\001\000\000\017\148\000\039\019DESKTOP-2E0N48E\04077\041._dosvc._tcp.local.
avahi_key_new() failed.
avahi_normalize_name() failed name \148\000\039\019DESKTOP-2E0N4.E\04091\041\006_dosvc\004_tcp\005local\000\192\012\000\012\000\001\000\000\017\148\000\039\019DESKTOP-2E0N48E\04093\041._dosvc._tcp.local.
avahi_key_new() failed.
[Repeated similar failures...]

I discovered that when the daemon prints the above messages, the return value of the DNSServiceBrowse function in my application is consistently -65537.

I found the service info which trigger this:

chenpeng@chenpeng-Precision-Tower-3620:~/Documents/mw_kvm$ sudo tcpdump -i enp0s31f6 "port 5353" | grep "DESKTOP-2E0N48E" tcpdump: verbose output suppressed, use -v[v]... for full protocol decode listening on enp0s31f6, link-type EN10MB (Ethernet), snapshot length 262144 bytes 10:05:30.785071 IP 10.10.34.28.mdns > mdns.mcast.net.mdns: 0*- [0q] 125/0/252 PTR DESKTOP-2E0N48E(152)._dosvc._tcp.local., PTR DESKTOP-2E0N48E(156)._dosvc._tcp.local., PTR DESKTOP-2E0N48E(164)._dosvc._tcp.local., PTR DESKTOP-2E0N48E(154)._dosvc._tcp.local., PTR DESKTOP-2E0N48E(160)._dosvc._tcp.local., PTR DESKTOP-2E0N48E(162)._dosvc._tcp.local., PTR DESKTOP-2E0N48E(170)._dosvc._tcp.local., PTR DESKTOP-2E0N48E(174)._dosvc._tcp.local., PTR DESKTOP-2E0N48E(178)._dosvc._tcp.local., PTR DESKTOP-2E0N48E(184)._dosvc._tcp.local., PTR DESKTOP-2E0N48E(190)._dosvc._tcp.local., PTR DESKTOP-2E0N48E(200)._dosvc._tcp.local., PTR DESKTOP-2E0N48E(205)._dosvc._tcp.local., PTR DESKTOP-2E0N48E(207)._dosvc._tcp.local., PTR DESKTOP-2E0N48E(209)._dosvc._tcp.local., PTR DESKTOP-2E0N48E(210)._dosvc._tcp.local., PTR DESKTOP-2E0N48E(212)._dosvc._tcp.local., PTR DESKTOP-2E0N48E(214)._dosvc._tcp.local., PTR DESKTOP-2E0N48E(216)._dosvc._tcp.local., PTR DESKTOP-2E0N48E(218)._dosvc._tcp.local., PTR DESKTOP-2E0N48E(219)._dosvc._tcp.local., PTR DESKTOP-2E0N48E(221)._dosvc._tcp.local., PTR DESKTOP-2E0N48E(223)._dosvc._tcp.local., PTR DESKTOP-2E0N48E(225)._dosvc._tcp.local., PTR DESKTOP-2E0N48E(227)._dosvc._tcp.local., PTR DESKTOP-2E0N48E(228)._dosvc._tcp.local., PTR DESKTOP-2E0N48E(229)._dosvc._tcp.local., PTR [|domain] 10:05:30.787906 IP 10.10.34.105.mdns > mdns.mcast.net.mdns: 0*- [0q] 126/0/254 PTR DESKTOP-2E0N48E(2)._dosvc._tcp.local., PTR DESKTOP-2E0N48E(3)._dosvc._tcp.local., PTR DESKTOP-2E0N48E(6)._dosvc._tcp.local., PTR DESKTOP-2E0N48E(7)._dosvc._tcp.local., PTR DESKTOP-2E0N48E(8)._dosvc._tcp.local., PTR DESKTOP-2E0N48E(9)._dosvc._tcp.local., PTR DESKTOP-2E0N48E(11)._dosvc._tcp.local., PTR DESKTOP-2E0N48E(13)._dosvc._tcp.local., PTR DESKTOP-2E0N48E(17)._dosvc._tcp.local., PTR DESKTOP-2E0N48E(21)._dosvc._tcp.local., PTR DESKTOP-2E0N48E(25)._dosvc._tcp.local., PTR DESKTOP-2E0N48E(29)._dosvc._tcp.local., PTR DESKTOP-2E0N48E(33)._dosvc._tcp.local., PTR DESKTOP-2E0N48E(37)._dosvc._tcp.local., PTR DESKTOP-2E0N48E(40)._dosvc._tcp.local., PTR DESKTOP-2E0N48E(42)._dosvc._tcp.local., PTR DESKTOP-2E0N48E(44)._dosvc._tcp.local., PTR DESKTOP-2E0N48E(46)._dosvc._tcp.local., PTR DESKTOP-2E0N48E(48)._dosvc._tcp.local., PTR DESKTOP-2E0N48E(50)._dosvc._tcp.local., PTR DESKTOP-2E0N48E(52)._dosvc._tcp.local., PTR DESKTOP-2E0N48E(54)._dosvc._tcp.local., PTR DESKTOP-2E0N48E(56)._dosvc._tcp.local., PTR DESKTOP-2E0N48E(58)._dosvc._tcp.local., PTR DESKTOP-2E0N48E(60)._dosvc._tcp.local., PTR DESKTOP-2E0N48E(62)._dosvc._tcp.local., PTR DESKTOP-2E0N48E(64)._dosvc._tcp.local., PTR DESKTOP-2E0N48E(66)._dosvc._tcp.local., PTR [|domain] 10:09:32.150934 IP 10.10.34.28.mdns > mdns.mcast.net.mdns: 0*- [0q] 125/0/252 PTR DESKTOP-2E0N48E(152)._dosvc._tcp.local., PTR DESKTOP-2E0N48E(156)._dosvc._tcp.local., PTR DESKTOP-2E0N48E(164)._dosvc._tcp.local., PTR DESKTOP-2E0N48E(154)._dosvc._tcp.local., PTR DESKTOP-2E0N48E(160)._dosvc._tcp.local., PTR DESKTOP-2E0N48E(162)._dosvc._tcp.local., PTR DESKTOP-2E0N48E(170)._dosvc._tcp.local., PTR DESKTOP-2E0N48E(174)._dosvc._tcp.local., PTR DESKTOP-2E0N48E(178)._dosvc._tcp.local., PTR DESKTOP-2E0N48E(184)._dosvc._tcp.local., PTR DESKTOP-2E0N48E(190)._dosvc._tcp.local., PTR DESKTOP-2E0N48E(200)._dosvc._tcp.local., PTR DESKTOP-2E0N48E(205)._dosvc._tcp.local., PTR DESKTOP-2E0N48E(207)._dosvc._tcp.local., PTR DESKTOP-2E0N48E(209)._dosvc._tcp.local., PTR DESKTOP-2E0N48E(210)._dosvc._tcp.local., PTR DESKTOP-2E0N48E(212)._dosvc._tcp.local., PTR DESKTOP-2E0N48E(214)._dosvc._tcp.local., PTR DESKTOP-2E0N48E(216)._dosvc._tcp.local., PTR DESKTOP-2E0N48E(218)._dosvc._tcp.local., PTR DESKTOP-2E0N48E(219)._dosvc._tcp.local., PTR DESKTOP-2E0N48E(221)._dosvc._tcp.local., PTR DESKTOP-2E0N48E(223)._dosvc._tcp.local., PTR DESKTOP-2E0N48E(225)._dosvc._tcp.local., PTR DESKTOP-2E0N48E(227)._dosvc._tcp.local., PTR DESKTOP-2E0N48E(228)._dosvc._tcp.local., PTR DESKTOP-2E0N48E(229)._dosvc._tcp.local., PTR [|domain] 10:09:32.154848 IP 10.10.34.105.mdns > mdns.mcast.net.mdns: 0*- [0q] 127/0/256 PTR DESKTOP-2E0N48E(2)._dosvc._tcp.local., PTR DESKTOP-2E0N48E(3)._dosvc._tcp.local., PTR DESKTOP-2E0N48E(6)._dosvc._tcp.local., PTR DESKTOP-2E0N48E(7)._dosvc._tcp.local., PTR DESKTOP-2E0N48E(8)._dosvc._tcp.local., PTR DESKTOP-2E0N48E(9)._dosvc._tcp.local., PTR DESKTOP-2E0N48E(11)._dosvc._tcp.local., PTR DESKTOP-2E0N48E(13)._dosvc._tcp.local., PTR DESKTOP-2E0N48E(17)._dosvc._tcp.local., PTR DESKTOP-2E0N48E(21)._dosvc._tcp.local., PTR DESKTOP-2E0N48E(25)._dosvc._tcp.local., PTR DESKTOP-2E0N48E(29)._dosvc._tcp.local., PTR DESKTOP-2E0N48E(33)._dosvc._tcp.local., PTR DESKTOP-2E0N48E(37)._dosvc._tcp.local., PTR DESKTOP-2E0N48E(40)._dosvc._tcp.local., PTR DESKTOP-2E0N48E(42)._dosvc._tcp.local., PTR DESKTOP-2E0N48E(44)._dosvc._tcp.local., PTR DESKTOP-2E0N48E(46)._dosvc._tcp.local., PTR DESKTOP-2E0N48E(48)._dosvc._tcp.local., PTR DESKTOP-2E0N48E(50)._dosvc._tcp.local., PTR DESKTOP-2E0N48E(52)._dosvc._tcp.local., PTR DESKTOP-2E0N48E(54)._dosvc._tcp.local., PTR DESKTOP-2E0N48E(56)._dosvc._tcp.local., PTR DESKTOP-2E0N48E(58)._dosvc._tcp.local., PTR DESKTOP-2E0N48E(60)._dosvc._tcp.local., PTR DESKTOP-2E0N48E(62)._dosvc._tcp.local., PTR DESKTOP-2E0N48E(64)._dosvc._tcp.local., PTR DESKTOP-2E0N48E(66)._dosvc._tcp.local., PTR [|domain] 10:10:17.086327 IP 10.10.34.28.mdns > mdns.mcast.net.mdns: 0*- [0q] 1/0/2 PTR DESKTOP-2E0N48E._dosvc._tcp.local. (234) 10:10:17.087035 IP6 fe80::e9f:182d:7b81:6307.mdns > ff02::fb.mdns: 0*- [0q] 1/0/2 PTR DESKTOP-2E0N48E._dosvc._tcp.local. (234) 10:10:17.088060 IP 10.10.34.28.mdns > mdns.mcast.net.mdns: 0 ANY (QM)? DESKTOP-2E0N48E._dosvc._tcp.local. (51) 10:10:17.088517 IP6 fe80::e9f:182d:7b81:6307.mdns > ff02::fb.mdns: 0 ANY (QM)? DESKTOP-2E0N48E._dosvc._tcp.local. (51) 10:10:17.339392 IP 10.10.34.28.mdns > mdns.mcast.net.mdns: 0 ANY (QM)? DESKTOP-2E0N48E._dosvc._tcp.local. (51) 10:10:17.339668 IP6 fe80::e9f:182d:7b81:6307.mdns > ff02::fb.mdns: 0 ANY (QM)? DESKTOP-2E0N48E._dosvc._tcp.local. (51) 10:10:17.590434 IP 10.10.34.28.mdns > mdns.mcast.net.mdns: 0 ANY (QM)? DESKTOP-2E0N48E._dosvc._tcp.local. (51) 10:10:17.590698 IP6 fe80::e9f:182d:7b81:6307.mdns > ff02::fb.mdns: 0 ANY (QM)? DESKTOP-2E0N48E._dosvc._tcp.local. (51) 10:10:17.842885 IP 10.10.34.28.mdns > mdns.mcast.net.mdns: 0*- [0q] 1/0/4 (Cache flush) PTR DESKTOP-2E0N48E._dosvc._tcp.local. (299) 10:10:17.843463 IP6 fe80::e9f:182d:7b81:6307.mdns > ff02::fb.mdns: 0*- [0q] 1/0/4 (Cache flush) PTR DESKTOP-2E0N48E._dosvc._tcp.local. (299) 10:10:17.843865 IP 10.10.34.28.mdns > mdns.mcast.net.mdns: 0*- [0q] 1/0/3 (Cache flush) SRV DESKTOP-2E0N48E.local.:7680 0 0 (235) 10:10:17.844125 IP6 fe80::e9f:182d:7b81:6307.mdns > ff02::fb.mdns: 0*- [0q] 1/0/3 (Cache flush) SRV DESKTOP-2E0N48E.local.:7680 0 0 (235) 10:10:21.256885 IP 10.10.34.105.mdns > mdns.mcast.net.mdns: 0 ANY (QM)? DESKTOP-2E0N48E._dosvc._tcp.local. (51) 10:10:21.257602 IP 10.10.34.28.mdns > mdns.mcast.net.mdns: 0*- [0q] 1/0/3 SRV DESKTOP-2E0N48E.local.:7680 0 0 (235) 10:10:21.259260 IP6 fe80::f28d:5506:4db8:b224.mdns > ff02::fb.mdns: 0 ANY (QM)? DESKTOP-2E0N48E._dosvc._tcp.local. (51) 10:10:21.259801 IP6 fe80::e9f:182d:7b81:6307.mdns > ff02::fb.mdns: 0*- [0q] 1/0/3 SRV DESKTOP-2E0N48E.local.:7680 0 0 (235) 10:10:21.262760 IP 10.10.34.105.mdns > mdns.mcast.net.mdns: 0 ANY (QM)? DESKTOP-2E0N48E(1)._dosvc._tcp.local. (54) 10:10:21.263410 IP6 fe80::f28d:5506:4db8:b224.mdns > ff02::fb.mdns: 0 ANY (QM)? DESKTOP-2E0N48E(1)._dosvc._tcp.local. (54) 10:10:21.264190 IP 10.10.34.105.mdns > mdns.mcast.net.mdns: 0*- [0q] 30/0/61 SRV DESKTOP-2E0N48E.local.:7680 0 0, PTR DESKTOP-2E0N48E(15)._dosvc._tcp.local., PTR DESKTOP-2E0N48E(19)._dosvc._tcp.local., PTR DESKTOP-2E0N48E(23)._dosvc._tcp.local., PTR DESKTOP-2E0N48E(4)._dosvc._tcp.local., PTR DESKTOP-2E0N48E(5)._dosvc._tcp.local., PTR DESKTOP-2E0N48E(10)._dosvc._tcp.local., PTR DESKTOP-2E0N48E(12)._dosvc._tcp.local., PTR DESKTOP-2E0N48E(27)._dosvc._tcp.local., PTR DESKTOP-2E0N48E(14)._dosvc._tcp.local., PTR DESKTOP-2E0N48E(16)._dosvc._tcp.local., PTR DESKTOP-2E0N48E(18)._dosvc._tcp.local., PTR DESKTOP-2E0N48E(20)._dosvc._tcp.local., PTR DESKTOP-2E0N48E(22)._dosvc._tcp.local., PTR DESKTOP-2E0N48E(24)._dosvc._tcp.local., PTR DESKTOP-2E0N48E(26)._dosvc._tcp.local., PTR DESKTOP-2E0N48E(28)._dosvc._tcp.local., PTR DESKTOP-2E0N48E(30)._dosvc._tcp.local., PTR DESKTOP-2E0N48E(32)._dosvc._tcp.local., PTR DESKTOP-2E0N48E(34)._dosvc._tcp.local., PTR DESKTOP-2E0N48E(36)._dosvc._tcp.local., PTR DESKTOP-2E0N48E(38)._dosvc._tcp.local., PTR DESKTOP-2E0N48E(84)._dosvc._tcp.local., PTR DESKTOP-2E0N48E(47)._dosvc._tcp.local., PTR DESKTOP-2E0N48E(51)._dosvc._tcp.local., PTR DESKTOP-2E0N48E(86)._dosvc._tcp.local., PTR DESKTOP-2E0N48E(88)._dosvc._tcp.local., PTR DESKTOP-2E0N48E(90)._dosvc._tcp.local., [|domain] 10:10:21.268281 IP 10.10.34.105.mdns > mdns.mcast.net.mdns: 0 ANY (QM)? DESKTOP-2E0N48E(2)._dosvc._tcp.local. (54) 10:10:21.269804 IP 10.10.34.28.mdns > mdns.mcast.net.mdns: 0*- [0q] 43/0/87 SRV DESKTOP-2E0N48E.local.:7680 0 0, PTR DESKTOP-2E0N48E(3)._dosvc._tcp.local., PTR DESKTOP-2E0N48E(6)._dosvc._tcp.local., PTR DESKTOP-2E0N48E(7)._dosvc._tcp.local., PTR DESKTOP-2E0N48E(8)._dosvc._tcp.local., PTR DESKTOP-2E0N48E(9)._dosvc._tcp.local., PTR DESKTOP-2E0N48E(11)._dosvc._tcp.local., PTR DESKTOP-2E0N48E(13)._dosvc._tcp.local., PTR DESKTOP-2E0N48E(17)._dosvc._tcp.local., PTR DESKTOP-2E0N48E(21)._dosvc._tcp.local., PTR DESKTOP-2E0N48E(25)._dosvc._tcp.local., PTR DESKTOP-2E0N48E(29)._dosvc._tcp.local., PTR DESKTOP-2E0N48E(31)._dosvc._tcp.local., PTR DESKTOP-2E0N48E(33)._dosvc._tcp.local., PTR DESKTOP-2E0N48E(35)._dosvc._tcp.local., PTR DESKTOP-2E0N48E(37)._dosvc._tcp.local., PTR DESKTOP-2E0N48E(39)._dosvc._tcp.local., PTR DESKTOP-2E0N48E(40)._dosvc._tcp.local., PTR DESKTOP-2E0N48E(41)._dosvc._tcp.local., PTR DESKTOP-2E0N48E(42)._dosvc._tcp.local., PTR DESKTOP-2E0N48E(43)._dosvc._tcp.local., PTR DESKTOP-2E0N48E(44)._dosvc._tcp.local., PTR DESKTOP-2E0N48E(45)._dosvc._tcp.local., PTR DESKTOP-2E0N48E(46)._dosvc._tcp.local., PTR DESKTOP-2E0N48E(48)._dosvc._tcp.local., PTR DESKTOP-2E0N48E(50)._dosvc._tcp.local., PTR DESKTOP-2E0N48E(52)._dosvc._tcp.local., PTR DESKTOP-2E0N48E(54)._dosvc._tcp.local., [|domain]

And when I block the IPs of the Windows services mentioned earlier( 10.10.34.105,  10.10.34.28) in the firewall (so the daemon no longer receives related mDNS packets), and restart the daemon, the DNSServiceBrowse service works normally. I think I have described the situation clearly.

**Comment by echo-hi** [comment]
sometimes avahi-browes return err, i am not sure it relates to 'normalize name' issue

![Image](https://github.com/user-attachments/assets/27321a4c-3fea-4552-893f-40f16b56c3a0)

**Comment by evverx** [comment]
As mentioned in https://github.com/avahi/avahi/issues/658 please try reproducing it with the master branch. If it's reproducible please attach the actual packets just in case. The compat library isn't maintained anymore so let's focus on avahi-browse only.

**Comment by evverx** [comment]
By the way the output of tcpdump you provided is different from what it really should look like with service names like that. For example it should show stuff like
```sh
M-^T^@'^SDESKTOP-2E0N4.E(91)^F_dosvc^D_tcp^Elocal^@M-@^L^@^L^@^A^@^@^QM-^T^@'^SDESKTOP-2E0N48E(93)._dosvc._tcp.local
```
but it's missing from your report. In fact the output of tcpdump you provided doesn't show any malformed service names at all.

Once again please reproduce it with the master branch and attach the actual packets instead of the output of tcpdump.

**Comment by evverx** [comment]
If LLMs are involved in producing this bug report please mention it explicitly. Your first comment in the other issue looks LLM-generated.

**Comment by evverx** [comment]
I'll go ahead and close this. I haven't been able to reproduce it with the provided service names.

It can always be reopened if it's reproducible with the master branch where things like 93b14365c1c1e04efd1a890e8caa01a2a514bfd8 and d19e5d749eefccbc6a53461ebea1d0747cc3948d are included and as long as the service names are provided.
