### ISSUE TITLE
sendmsg() to ff02::fb failed: Invalid argument

### ISSUE THREAD

**Issue by ceggers-arri** [avahi/avahi#615]
If running the `avahi-daemon` with `--debug`, I see the following messages after attaching the network cable:

```
sendmsg() to ff02::fb failed: Invalid argument
sendmsg() to ff02::fb failed: Invalid argument
sendmsg() to ff02::fb failed: Invalid argument
sendmsg() to ff02::fb failed: Invalid argument
```
My main concern is, that some probably important messages are dropped by the kernel so that other nodes on the network cannot receive them (as long as sending them is not further repeated by Avahi).

The Avahi call stack is:
```
sendmsg_loop()
avahi_send_dns_packet_ipv6()
avahi_interface_send_packet_unicast()
avahi_interface_send_packet()
elapse_callback()
```

I found out that the `-EINVAL` is returned concretely by the kernel here (note that `-EINVAL` is also used at many other locations in the UDPv6 tx path):
```
int ip6_datagram_send_ctl()
{
...
		switch (cmsg->cmsg_type) {
		case IPV6_PKTINFO:
			...
			if (addr_type != IPV6_ADDR_ANY) {
				int strict = __ipv6_addr_src_scope(addr_type) <= IPV6_ADDR_SCOPE_LINKLOCAL;
				if (!ipv6_can_nonlocal_bind(net, inet_sk(sk)) &&
				    !ipv6_chk_addr_and_flags(net, &src_info->ipi6_addr,
							     dev, !strict, 0,
							     IFA_F_TENTATIVE) &&
				    !ipv6_chk_acast_addr_src(net, dev,
							     &src_info->ipi6_addr))
					err = -EINVAL;  <-- this one
				else
					fl6->saddr = src_info->ipi6_addr;
			}
			...
		}
...
}
```
The problem seems to be, that avahi-daemon starts sending datagrams with `IPV6_PKTINFO` as soon as an address (e.g. IPv6 link local) is added to the interface. But during the _IPv6 Duplicate Address Detection (DAD)_ phase, the `IFA_F_TENTATIVE` flag is set for that address and the kernel refuses to use it as source IP.

A possible exception from this rule is if _Optimistic Duplicate Address Detection_ ([RFC4429](https://tools.ietf.org/rfc/rfc4429.txt)) would be active, in this case additionally the `IFA_F_OPTIMISTIC` flag could be set and the address may be used from the early beginning:
```
__ipv6_chk_addr_and_flags()
{
...
		ifp_flags = (ifp->flags&IFA_F_OPTIMISTIC)
			    ? (ifp->flags&~IFA_F_TENTATIVE)   <-- IFA_F_TENTATIVE is masked out if IFA_F_OPTIMISTIC is set
			    : ifp->flags;
...
}
```

But _Optimistic Duplicate Address Detection_ depends on ...
1. the kernel option `CONFIG_IPV6_OPTIMISTIC_DAD=y` 
2. `/proc/sys/net/ipv6/conf/interface/optimistic_dad` == `1` (default: `0`). 
3. Probably `IFA_F_OPTIMISTIC` must be set during configuration of the IP address (apparently not the case with _NetworkManager_)

None of them are enabled on my host distro, so Avahi cannot rely on it.

A probably better alternative would be waiting until the `IFA_F_TENTATIVE` flag is removed from a new address. On my system this takes about one second and can probably be monitored via netlink.

**Comment by evverx** [comment]
Looks like it's a duplicate of https://github.com/avahi/avahi/issues/555.

**Comment by evverx** [comment]
Having taken a look at https://github.com/avahi/avahi/issues/555 a bit closer it seems the error code is different there so it doesn't seem to be a duplicate after all.

**Comment by ceggers-arri** [comment]
> Having taken a look at #555 a bit closer it seems the error code is different there so it doesn't seem to be a duplicate after all.

I already read #555 before posting this, I think this one is different. Are you able to reproduce it? For me it feels that every system using IPv6 should be affected.

**Comment by evverx** [comment]
I've just reproduced it by bringing down an interface and bringing it up again.
```
New relevant interface eth1.IPv4 for mDNS.
Registering new address record for 192.168.56.4 on eth1.IPv4.
sendmsg() to ff02::fb (iface #3) failed: Invalid argument
sendmsg() to ff02::fb (iface #3) failed: Invalid argument
sendmsg() to ff02::fb (iface #3) failed: Invalid argument
sendmsg() to ff02::fb (iface #3) failed: Invalid argument
sendmsg() to ff02::fb (iface #3) failed: Invalid argument
sendmsg() to ff02::fb (iface #3) failed: Invalid argument
```

**Comment by evverx** [comment]
> some probably important messages are dropped by the kernel so that other nodes on the network cannot receive them

It seems to be the case. Normally avahi sends probes and announcements
```
16:29:13.820013 IP6 fedora.local.mdns > ff02::fb.mdns: 0 [2q] [2n] ANY (QM)? 9.b.d.3.4.4.0.f.6.2.6.e.9.9.2.7.0.0.0.0.0.0.0.0.0.0.0.0.0.8.e.f.ip6.arpa. ANY (QM)? fedora.local. (150)
16:29:14.071857 IP6 fedora.local.mdns > ff02::fb.mdns: 0 [2q] [2n] ANY (QM)? 9.b.d.3.4.4.0.f.6.2.6.e.9.9.2.7.0.0.0.0.0.0.0.0.0.0.0.0.0.8.e.f.ip6.arpa. ANY (QM)? fedora.local. (150)
16:29:14.324494 IP6 fedora.local.mdns > ff02::fb.mdns: 0 [2q] [2n] ANY (QM)? 9.b.d.3.4.4.0.f.6.2.6.e.9.9.2.7.0.0.0.0.0.0.0.0.0.0.0.0.0.8.e.f.ip6.arpa. ANY (QM)? fedora.local. (150)
16:29:14.527569 IP6 fedora.local.mdns > ff02::fb.mdns: 0*- [0q] 2/0/0 (Cache flush) PTR fedora.local., (Cache flush) AAAA fe80::7299:e626:f044:3db9 (138)
16:29:15.661919 IP6 fedora.local.mdns > ff02::fb.mdns: 0*- [0q] 2/0/0 (Cache flush) PTR fedora.local., (Cache flush) AAAA fe80::7299:e626:f044:3db9 (138)
16:29:17.800157 IP6 fedora.local.mdns > ff02::fb.mdns: 0*- [0q] 2/0/0 (Cache flush) PTR fedora.local., (Cache flush) AAAA fe80::7299:e626:f044:3db9 (138)
```
When the interface was brought down and up again only the announcements got through and were received on another machine:
```
16:25:49.832003 IP6 fedora.local.mdns > ff02::fb.mdns: 0*- [0q] 2/0/0 (Cache flush) PTR fedora.local., (Cache flush) AAAA fe80::7299:e626:f044:3db9 (138)
16:25:51.905363 IP6 fedora.local.mdns > ff02::fb.mdns: 0*- [0q] 2/0/0 (Cache flush) PTR fedora.local., (Cache flush) AAAA fe80::7299:e626:f044:3db9 (138)
```

**Comment by ceggers-arri** [comment]
> > some probably important messages are dropped by the kernel so that other nodes on the network cannot receive them
> 
> It seems to be the case. Normally avahi sends probes and announcements
> 
That is exactly what I expected. As there are enough `RTM_NEWADDR` events, we can simply skip them until the `IFA_F_TENTATIVE` flag is cleared by the kernel.
