### ISSUE TITLE
avahi logs "avahi_normalize_name() failed"

### ISSUE THREAD

**Issue by kaynemo** [avahi/avahi#658]
**Avahi version**
avahi-daemon 0.8

**Distribution**
Ubuntu server 22
**Describe the bug**
I have avahi-daemon as part of the Netatalk package. It starts fine and machinename.local is broadcasted over the network, but my systemctl status avahi-daemon returns this:

avahi-daemon[454292]: avahi_normalize_name() failed.
avahi-daemon[454292]: avahi_key_new() failed.

No matter what I do (I've been going over configs and whatnot for weeks now) this error returns

**To Reproduce**
Start avahi-daemon, check systemctl status

**Expected behavior**

**Avahi config files if applicable**
(`/etc/avahi/avahi-daemon.conf`, `/etc/avahi/hosts`, `/etc/avahi/services/*.service`)

**Avahi debug logs if applicable**
(Debug logs can be turned on by passing `--debug` to `avahi-daemon`)

**Additional context**

**Comment by evverx** [comment]
Those log messages usually indicate that avahi receives mDNS packets with malformed names. Can you run avahi with the `--debug` option to see if avahi also emits messages like
```sh
server.c: Packet too short or invalid while reading response record. (Maybe a UTF-8 problem?)
```

**Comment by kaynemo** [comment]
I've tried to run it with --debug, and voila:
server.c: Packet too short or invalid while reading response record. (Maybe a UTF-8 problem?)
what does it mean and what can I do about it?

**Comment by evverx** [comment]
It indicates that avahi receives mDNS packets with invalid names. It should be possible to capture mDNS packets with tcpdump/wireshark/... to try to figure out where they come from and fix whatever sends them.

(It would be an avahi bug if avahi complained about valid packets. If packets aren't valid it's unlikely to be an avahi bug and should be reported/fixed elsewhere. avahi is just the messenger here)

**Comment by kaynemo** [comment]
Thank you - I will search local network for errors

**Comment by evverx** [comment]
https://bugs.debian.org/cgi-bin/bugreport.cgi?bug=754185#30 is an example of what it can look like.

I'll close this issue because it's unlikely to be an avahi bug but if the packets triggering it turn out to be valid this issue can always be reopened.

**Comment by echo-hi** [comment]
i'm experiencing a critical stability issue with Avahi where avahi_normalize_name() failures cause the daemon to crash completely. This manifests as the avahi-browse tool returning error code -65537, which severely impacts all processes that depend on Avahi for service discovery.
The core issue appears to be insufficient error handling around the avahi_normalize_name() function. When this function fails (typically due to malformed or unexpected service names in the network environment), it triggers a cascading failure that brings down the entire daemon rather than gracefully handling the problematic input.

This is not just a minor inconvenience - it's a serious robustness problem with real-world consequences:

Complete service discovery breakdown in affected environments

Critical services that rely on Avahi (like printing, file sharing, media streaming) become unavailable

The daemon crashes require manual intervention to restore functionality

**Comment by evverx** [comment]
> When this function fails (typically due to malformed or unexpected service names in the network environment), it triggers a cascading failure that brings down the entire daemon rather than gracefully handling the problematic input.

Was it hallucinated by an LLM? avahi is regularly tested under ASan/UBsan/Valgrind to make sure that it can withstand that sort of thing with all sorts of malformed packets. It's possible that it can have bugs of course but it would be great if you could be more specific and attach specific packets along with specific ASan/Valgrind backtraces showing how it can actually be reproduced.

**Comment by echo-hi** [comment]
I add  log to print service name in avahi_key_new like follow:
`  avahi_log_error("avahi_normalize_name() failed name %s.",name);`
and i get log:
`chenpeng@chenpeng-Precision-Tower-3620:~/Documents/avahi/avahi-daemon$ sudo ./avahi-daemon 
Found user 'avahi' (UID 114) and group 'avahi' (GID 121).
Successfully dropped root privileges.
avahi-daemon 0.8 starting up.
No service file found in /etc/avahi/services.
Joining mDNS multicast group on interface enp0s31f6.IPv4 with address 10.10.34.29.
New relevant interface enp0s31f6.IPv4 for mDNS.
Network interface enumeration completed.
Registering new address record for fe80::56bf:64ff:fe7d:2fa5 on enp0s31f6.*.
Registering new address record for 10.10.34.29 on enp0s31f6.IPv4.
Server startup complete. Host name is chenpeng-Precision-Tower-3620.local. Local service cookie is 2136423298.
avahi_normalize_name() failed name 2E0N48E\04067\041\006_dosvc\004_tcp\005local\000\000\033\000\001\000\000\000x\000\029\000\000\000\000\030.
avahi_key_new() failed.
avahi_normalize_name() failed name E\04075\041\006_dosvc\004_tcp\005local\000\192\012\000\012\000\001\000\000\017\148\000\039\019DESKTOP-2E0N48E\04077\041._dosvc._tcp.local.
avahi_key_new() failed.
avahi_normalize_name() failed name \148\000\039\019DESKTOP-2E0N4.E\04091\041\006_dosvc\004_tcp\005local\000\192\012\000\012\000\001\000\000\017\148\000\039\019DESKTOP-2E0N48E\04093\041._dosvc._tcp.local.
avahi_key_new() failed.
avahi_normalize_name() failed name \000.
avahi_key_new() failed.
avahi_normalize_name() failed name \148\000\039\019DESKTOP-2E0N4.E\04063\041\006_dosvc\004_tcp\005local\000\192\012\000\012\000\001\000\000\017\148\000\039\019DESKTOP-2E0N48E\04065\041._dosvc._tcp.local.
avahi_key_new() failed.
avahi_normalize_name() failed name \000.
avahi_key_new() failed.
avahi_normalize_name() failed name \000.
avahi_key_new() failed.
avahi_normalize_name() failed name \148\000\039\019DESKTOP-2E0N4.E\04063\041\006_dosvc\004_tcp\005local\000\192\012\000\012\000\001\000\000\017\148\000\039\019DESKTOP-2E0N48E\04065\041._dosvc._tcp.local.
avahi_key_new() failed.
avahi_normalize_name() failed name \000.
avahi_key_new() failed.
avahi_normalize_name() failed name \148\000\039\019DESKTOP-2E0N4.E\04063\041\006_dosvc\004_tcp\005local\000\192\012\000\012\000\001\000\000\017\148\000\039\019DESKTOP-2E0N48E\04065\041._dosvc._tcp.local.
avahi_key_new() failed.
avahi_normalize_name() failed name \148\000\039\019DESKTOP-2E0N4.E\04063\041\006_dosvc\004_tcp\005local\000\192\012\000\012\000\001\000\000\017\148\000\039\019DESKTOP-2E0N48E\04065\041._dosvc._tcp.local.
avahi_key_new() failed.
avahi_normalize_name() failed name \148\000\039\019DESKTOP-2E0N4.E\04063\041\006_dosvc\004_tcp\005local\000\192\012\000\012\000\001\000\000\017\148\000\039\019DESKTOP-2E0N48E\04065\041._dosvc._tcp.local.
avahi_key_new() failed.`

i try to catch the packet and get then something like this

`chenpeng@chenpeng-Precision-Tower-3620:~/Documents/mw_kvm$ sudo tcpdump -i enp0s31f6 "port 5353" | grep "DESKTOP-2E0N48E"
tcpdump: verbose output suppressed, use -v[v]... for full protocol decode
listening on enp0s31f6, link-type EN10MB (Ethernet), snapshot length 262144 bytes
10:05:30.785071 IP 10.10.34.28.mdns > mdns.mcast.net.mdns: 0*- [0q] 125/0/252 PTR DESKTOP-2E0N48E(152)._dosvc._tcp.local., PTR DESKTOP-2E0N48E(156)._dosvc._tcp.local., PTR DESKTOP-2E0N48E(164)._dosvc._tcp.local., PTR DESKTOP-2E0N48E(154)._dosvc._tcp.local., PTR DESKTOP-2E0N48E(160)._dosvc._tcp.local., PTR DESKTOP-2E0N48E(162)._dosvc._tcp.local., PTR DESKTOP-2E0N48E(170)._dosvc._tcp.local., PTR DESKTOP-2E0N48E(174)._dosvc._tcp.local., PTR DESKTOP-2E0N48E(178)._dosvc._tcp.local., PTR DESKTOP-2E0N48E(184)._dosvc._tcp.local., PTR DESKTOP-2E0N48E(190)._dosvc._tcp.local., PTR DESKTOP-2E0N48E(200)._dosvc._tcp.local., PTR DESKTOP-2E0N48E(205)._dosvc._tcp.local., PTR DESKTOP-2E0N48E(207)._dosvc._tcp.local., PTR DESKTOP-2E0N48E(209)._dosvc._tcp.local., PTR DESKTOP-2E0N48E(210)._dosvc._tcp.local., PTR DESKTOP-2E0N48E(212)._dosvc._tcp.local., PTR DESKTOP-2E0N48E(214)._dosvc._tcp.local., PTR DESKTOP-2E0N48E(216)._dosvc._tcp.local., PTR DESKTOP-2E0N48E(218)._dosvc._tcp.local., PTR DESKTOP-2E0N48E(219)._dosvc._tcp.local., PTR DESKTOP-2E0N48E(221)._dosvc._tcp.local., PTR DESKTOP-2E0N48E(223)._dosvc._tcp.local., PTR DESKTOP-2E0N48E(225)._dosvc._tcp.local., PTR DESKTOP-2E0N48E(227)._dosvc._tcp.local., PTR DESKTOP-2E0N48E(228)._dosvc._tcp.local., PTR DESKTOP-2E0N48E(229)._dosvc._tcp.local., PTR [|domain]
10:05:30.787906 IP 10.10.34.105.mdns > mdns.mcast.net.mdns: 0*- [0q] 126/0/254 PTR DESKTOP-2E0N48E(2)._dosvc._tcp.local., PTR DESKTOP-2E0N48E(3)._dosvc._tcp.local., PTR DESKTOP-2E0N48E(6)._dosvc._tcp.local., PTR DESKTOP-2E0N48E(7)._dosvc._tcp.local., PTR DESKTOP-2E0N48E(8)._dosvc._tcp.local., PTR DESKTOP-2E0N48E(9)._dosvc._tcp.local., PTR DESKTOP-2E0N48E(11)._dosvc._tcp.local., PTR DESKTOP-2E0N48E(13)._dosvc._tcp.local., PTR DESKTOP-2E0N48E(17)._dosvc._tcp.local., PTR DESKTOP-2E0N48E(21)._dosvc._tcp.local., PTR DESKTOP-2E0N48E(25)._dosvc._tcp.local., PTR DESKTOP-2E0N48E(29)._dosvc._tcp.local., PTR DESKTOP-2E0N48E(33)._dosvc._tcp.local., PTR DESKTOP-2E0N48E(37)._dosvc._tcp.local., PTR DESKTOP-2E0N48E(40)._dosvc._tcp.local., PTR DESKTOP-2E0N48E(42)._dosvc._tcp.local., PTR DESKTOP-2E0N48E(44)._dosvc._tcp.local., PTR DESKTOP-2E0N48E(46)._dosvc._tcp.local., PTR DESKTOP-2E0N48E(48)._dosvc._tcp.local., PTR DESKTOP-2E0N48E(50)._dosvc._tcp.local., PTR DESKTOP-2E0N48E(52)._dosvc._tcp.local., PTR DESKTOP-2E0N48E(54)._dosvc._tcp.local., PTR DESKTOP-2E0N48E(56)._dosvc._tcp.local., PTR DESKTOP-2E0N48E(58)._dosvc._tcp.local., PTR DESKTOP-2E0N48E(60)._dosvc._tcp.local., PTR DESKTOP-2E0N48E(62)._dosvc._tcp.local., PTR DESKTOP-2E0N48E(64)._dosvc._tcp.local., PTR DESKTOP-2E0N48E(66)._dosvc._tcp.local., PTR [|domain]
10:09:32.150934 IP 10.10.34.28.mdns > mdns.mcast.net.mdns: 0*- [0q] 125/0/252 PTR DESKTOP-2E0N48E(152)._dosvc._tcp.local., PTR DESKTOP-2E0N48E(156)._dosvc._tcp.local., PTR DESKTOP-2E0N48E(164)._dosvc._tcp.local., PTR DESKTOP-2E0N48E(154)._dosvc._tcp.local., PTR DESKTOP-2E0N48E(160)._dosvc._tcp.local., PTR DESKTOP-2E0N48E(162)._dosvc._tcp.local., PTR DESKTOP-2E0N48E(170)._dosvc._tcp.local., PTR DESKTOP-2E0N48E(174)._dosvc._tcp.local., PTR DESKTOP-2E0N48E(178)._dosvc._tcp.local., PTR DESKTOP-2E0N48E(184)._dosvc._tcp.local., PTR DESKTOP-2E0N48E(190)._dosvc._tcp.local., PTR DESKTOP-2E0N48E(200)._dosvc._tcp.local., PTR DESKTOP-2E0N48E(205)._dosvc._tcp.local., PTR DESKTOP-2E0N48E(207)._dosvc._tcp.local., PTR DESKTOP-2E0N48E(209)._dosvc._tcp.local., PTR DESKTOP-2E0N48E(210)._dosvc._tcp.local., PTR DESKTOP-2E0N48E(212)._dosvc._tcp.local., PTR DESKTOP-2E0N48E(214)._dosvc._tcp.local., PTR DESKTOP-2E0N48E(216)._dosvc._tcp.local., PTR DESKTOP-2E0N48E(218)._dosvc._tcp.local., PTR DESKTOP-2E0N48E(219)._dosvc._tcp.local., PTR DESKTOP-2E0N48E(221)._dosvc._tcp.local., PTR DESKTOP-2E0N48E(223)._dosvc._tcp.local., PTR DESKTOP-2E0N48E(225)._dosvc._tcp.local., PTR DESKTOP-2E0N48E(227)._dosvc._tcp.local., PTR DESKTOP-2E0N48E(228)._dosvc._tcp.local., PTR DESKTOP-2E0N48E(229)._dosvc._tcp.local., PTR [|domain]
10:09:32.154848 IP 10.10.34.105.mdns > mdns.mcast.net.mdns: 0*- [0q] 127/0/256 PTR DESKTOP-2E0N48E(2)._dosvc._tcp.local., PTR DESKTOP-2E0N48E(3)._dosvc._tcp.local., PTR DESKTOP-2E0N48E(6)._dosvc._tcp.local., PTR DESKTOP-2E0N48E(7)._dosvc._tcp.local., PTR DESKTOP-2E0N48E(8)._dosvc._tcp.local., PTR DESKTOP-2E0N48E(9)._dosvc._tcp.local., PTR DESKTOP-2E0N48E(11)._dosvc._tcp.local., PTR DESKTOP-2E0N48E(13)._dosvc._tcp.local., PTR DESKTOP-2E0N48E(17)._dosvc._tcp.local., PTR DESKTOP-2E0N48E(21)._dosvc._tcp.local., PTR DESKTOP-2E0N48E(25)._dosvc._tcp.local., PTR DESKTOP-2E0N48E(29)._dosvc._tcp.local., PTR DESKTOP-2E0N48E(33)._dosvc._tcp.local., PTR DESKTOP-2E0N48E(37)._dosvc._tcp.local., PTR DESKTOP-2E0N48E(40)._dosvc._tcp.local., PTR DESKTOP-2E0N48E(42)._dosvc._tcp.local., PTR DESKTOP-2E0N48E(44)._dosvc._tcp.local., PTR DESKTOP-2E0N48E(46)._dosvc._tcp.local., PTR DESKTOP-2E0N48E(48)._dosvc._tcp.local., PTR DESKTOP-2E0N48E(50)._dosvc._tcp.local., PTR DESKTOP-2E0N48E(52)._dosvc._tcp.local., PTR DESKTOP-2E0N48E(54)._dosvc._tcp.local., PTR DESKTOP-2E0N48E(56)._dosvc._tcp.local., PTR DESKTOP-2E0N48E(58)._dosvc._tcp.local., PTR DESKTOP-2E0N48E(60)._dosvc._tcp.local., PTR DESKTOP-2E0N48E(62)._dosvc._tcp.local., PTR DESKTOP-2E0N48E(64)._dosvc._tcp.local., PTR DESKTOP-2E0N48E(66)._dosvc._tcp.local., PTR [|domain]
10:10:17.086327 IP 10.10.34.28.mdns > mdns.mcast.net.mdns: 0*- [0q] 1/0/2 PTR DESKTOP-2E0N48E._dosvc._tcp.local. (234)
10:10:17.087035 IP6 fe80::e9f:182d:7b81:6307.mdns > ff02::fb.mdns: 0*- [0q] 1/0/2 PTR DESKTOP-2E0N48E._dosvc._tcp.local. (234)
10:10:17.088060 IP 10.10.34.28.mdns > mdns.mcast.net.mdns: 0 ANY (QM)? DESKTOP-2E0N48E._dosvc._tcp.local. (51)
10:10:17.088517 IP6 fe80::e9f:182d:7b81:6307.mdns > ff02::fb.mdns: 0 ANY (QM)? DESKTOP-2E0N48E._dosvc._tcp.local. (51)
10:10:17.339392 IP 10.10.34.28.mdns > mdns.mcast.net.mdns: 0 ANY (QM)? DESKTOP-2E0N48E._dosvc._tcp.local. (51)
10:10:17.339668 IP6 fe80::e9f:182d:7b81:6307.mdns > ff02::fb.mdns: 0 ANY (QM)? DESKTOP-2E0N48E._dosvc._tcp.local. (51)
10:10:17.590434 IP 10.10.34.28.mdns > mdns.mcast.net.mdns: 0 ANY (QM)? DESKTOP-2E0N48E._dosvc._tcp.local. (51)
10:10:17.590698 IP6 fe80::e9f:182d:7b81:6307.mdns > ff02::fb.mdns: 0 ANY (QM)? DESKTOP-2E0N48E._dosvc._tcp.local. (51)
10:10:17.842885 IP 10.10.34.28.mdns > mdns.mcast.net.mdns: 0*- [0q] 1/0/4 (Cache flush) PTR DESKTOP-2E0N48E._dosvc._tcp.local. (299)
10:10:17.843463 IP6 fe80::e9f:182d:7b81:6307.mdns > ff02::fb.mdns: 0*- [0q] 1/0/4 (Cache flush) PTR DESKTOP-2E0N48E._dosvc._tcp.local. (299)
10:10:17.843865 IP 10.10.34.28.mdns > mdns.mcast.net.mdns: 0*- [0q] 1/0/3 (Cache flush) SRV DESKTOP-2E0N48E.local.:7680 0 0 (235)
10:10:17.844125 IP6 fe80::e9f:182d:7b81:6307.mdns > ff02::fb.mdns: 0*- [0q] 1/0/3 (Cache flush) SRV DESKTOP-2E0N48E.local.:7680 0 0 (235)
10:10:21.256885 IP 10.10.34.105.mdns > mdns.mcast.net.mdns: 0 ANY (QM)? DESKTOP-2E0N48E._dosvc._tcp.local. (51)
10:10:21.257602 IP 10.10.34.28.mdns > mdns.mcast.net.mdns: 0*- [0q] 1/0/3 SRV DESKTOP-2E0N48E.local.:7680 0 0 (235)
10:10:21.259260 IP6 fe80::f28d:5506:4db8:b224.mdns > ff02::fb.mdns: 0 ANY (QM)? DESKTOP-2E0N48E._dosvc._tcp.local. (51)
10:10:21.259801 IP6 fe80::e9f:182d:7b81:6307.mdns > ff02::fb.mdns: 0*- [0q] 1/0/3 SRV DESKTOP-2E0N48E.local.:7680 0 0 (235)
10:10:21.262760 IP 10.10.34.105.mdns > mdns.mcast.net.mdns: 0 ANY (QM)? DESKTOP-2E0N48E(1)._dosvc._tcp.local. (54)
10:10:21.263410 IP6 fe80::f28d:5506:4db8:b224.mdns > ff02::fb.mdns: 0 ANY (QM)? DESKTOP-2E0N48E(1)._dosvc._tcp.local. (54)
10:10:21.264190 IP 10.10.34.105.mdns > mdns.mcast.net.mdns: 0*- [0q] 30/0/61 SRV DESKTOP-2E0N48E.local.:7680 0 0, PTR DESKTOP-2E0N48E(15)._dosvc._tcp.local., PTR DESKTOP-2E0N48E(19)._dosvc._tcp.local., PTR DESKTOP-2E0N48E(23)._dosvc._tcp.local., PTR DESKTOP-2E0N48E(4)._dosvc._tcp.local., PTR DESKTOP-2E0N48E(5)._dosvc._tcp.local., PTR DESKTOP-2E0N48E(10)._dosvc._tcp.local., PTR DESKTOP-2E0N48E(12)._dosvc._tcp.local., PTR DESKTOP-2E0N48E(27)._dosvc._tcp.local., PTR DESKTOP-2E0N48E(14)._dosvc._tcp.local., PTR DESKTOP-2E0N48E(16)._dosvc._tcp.local., PTR DESKTOP-2E0N48E(18)._dosvc._tcp.local., PTR DESKTOP-2E0N48E(20)._dosvc._tcp.local., PTR DESKTOP-2E0N48E(22)._dosvc._tcp.local., PTR DESKTOP-2E0N48E(24)._dosvc._tcp.local., PTR DESKTOP-2E0N48E(26)._dosvc._tcp.local., PTR DESKTOP-2E0N48E(28)._dosvc._tcp.local., PTR DESKTOP-2E0N48E(30)._dosvc._tcp.local., PTR DESKTOP-2E0N48E(32)._dosvc._tcp.local., PTR DESKTOP-2E0N48E(34)._dosvc._tcp.local., PTR DESKTOP-2E0N48E(36)._dosvc._tcp.local., PTR DESKTOP-2E0N48E(38)._dosvc._tcp.local., PTR DESKTOP-2E0N48E(84)._dosvc._tcp.local., PTR DESKTOP-2E0N48E(47)._dosvc._tcp.local., PTR DESKTOP-2E0N48E(51)._dosvc._tcp.local., PTR DESKTOP-2E0N48E(86)._dosvc._tcp.local., PTR DESKTOP-2E0N48E(88)._dosvc._tcp.local., PTR DESKTOP-2E0N48E(90)._dosvc._tcp.local., [|domain]
10:10:21.268281 IP 10.10.34.105.mdns > mdns.mcast.net.mdns: 0 ANY (QM)? DESKTOP-2E0N48E(2)._dosvc._tcp.local. (54)
10:10:21.269804 IP 10.10.34.28.mdns > mdns.mcast.net.mdns: 0*- [0q] 43/0/87 SRV DESKTOP-2E0N48E.local.:7680 0 0, PTR DESKTOP-2E0N48E(3)._dosvc._tcp.local., PTR DESKTOP-2E0N48E(6)._dosvc._tcp.local., PTR DESKTOP-2E0N48E(7)._dosvc._tcp.local., PTR DESKTOP-2E0N48E(8)._dosvc._tcp.local., PTR DESKTOP-2E0N48E(9)._dosvc._tcp.local., PTR DESKTOP-2E0N48E(11)._dosvc._tcp.local., PTR DESKTOP-2E0N48E(13)._dosvc._tcp.local., PTR DESKTOP-2E0N48E(17)._dosvc._tcp.local., PTR DESKTOP-2E0N48E(21)._dosvc._tcp.local., PTR DESKTOP-2E0N48E(25)._dosvc._tcp.local., PTR DESKTOP-2E0N48E(29)._dosvc._tcp.local., PTR DESKTOP-2E0N48E(31)._dosvc._tcp.local., PTR DESKTOP-2E0N48E(33)._dosvc._tcp.local., PTR DESKTOP-2E0N48E(35)._dosvc._tcp.local., PTR DESKTOP-2E0N48E(37)._dosvc._tcp.local., PTR DESKTOP-2E0N48E(39)._dosvc._tcp.local., PTR DESKTOP-2E0N48E(40)._dosvc._tcp.local., PTR DESKTOP-2E0N48E(41)._dosvc._tcp.local., PTR DESKTOP-2E0N48E(42)._dosvc._tcp.local., PTR DESKTOP-2E0N48E(43)._dosvc._tcp.local., PTR DESKTOP-2E0N48E(44)._dosvc._tcp.local., PTR DESKTOP-2E0N48E(45)._dosvc._tcp.local., PTR DESKTOP-2E0N48E(46)._dosvc._tcp.local., PTR DESKTOP-2E0N48E(48)._dosvc._tcp.local., PTR DESKTOP-2E0N48E(50)._dosvc._tcp.local., PTR DESKTOP-2E0N48E(52)._dosvc._tcp.local., PTR DESKTOP-2E0N48E(54)._dosvc._tcp.local., [|domain]`


It appears to be a service name conflict issue/

**Comment by echo-hi** [comment]
In this situation, my application (which relies on the Avahi library) is constantly reporting errors:
`2025-12-04 16:29:36:663 (tid:77554 mdns.cpp:870 _browse_service)] DNSServiceProcessResult timed out or cancelled
[2025-12-04 16:29:36:664 (tid:77554 service_discovery.cpp:223 mw_nmos_discover_registration_service)] mDNS resolve services failed.
[2025-12-04 16:29:36:664 (tid:77554 node_behaviour.cpp:187 _discover_registration_services)] Discover registration services failed. err=6
[2025-12-04 16:29:36:764 (tid:77554 mdns.cpp:826 _browse_service)] DNSServiceBrowse for reg_type: _nmos-register._tcp, domain: local., interface_id: 0
[2025-12-04 16:29:37:765 (tid:77554 mdns.cpp:870 _browse_service)] DNSServiceProcessResult timed out or cancelled
[2025-12-04 16:29:37:765 (tid:77554 service_discovery.cpp:223 mw_nmos_discover_registration_service)] mDNS resolve services failed.
[2025-12-04 16:29:37:765 (tid:77554 node_behaviour.cpp:187 _discover_registration_services)] Discover registration services failed. err=6
[2025-12-04 16:29:37:865 (tid:77554 mdns.cpp:826 _browse_service)] DNSServiceBrowse for reg_type: _nmos-register._tcp, domain: local., interface_id: 0
[2025-12-04 16:29:38:865 (tid:77554 mdns.cpp:870 _browse_service)] DNSServiceProcessResult timed out or cancelled
[2025-12-04 16:29:38:866 (tid:77554 service_discovery.cpp:223 mw_nmos_discover_registration_service)] mDNS resolve services failed.
[2025-12-04 16:29:38:866 (tid:77554 node_behaviour.cpp:187 _discover_registration_services)] Discover registration services failed. err=6
[2025-12-04 16:29:38:966 (tid:77554 mdns.cpp:826 _browse_service)] DNSServiceBrowse for reg_type: _nmos-register._tcp, domain: local., interface_id: 0`

**Comment by evverx** [comment]
You wrote that there was "a cascading failure that brings down the entire daemon". I can't see where exactly it was brought down. I'm not sure what your application does either. Can you try reproducing it with the master branch of avahi and open a new issue if whatever it is is still reproducible? The issue form has the "Steps to reproduce the behavior:" field. Please attach actual packets (instead of the output of the tcpdump), the code of your application and all the relevant information required to reproduce it.

**Comment by echo-hi** [comment]
This issue occurs during the broadcasting of the `_dosvc._tcp.local.` service. I am not familiar with the service broadcasting processes of other Windows hosts in the network environment. However, based on the logs, it is highly likely that multiple Windows hosts broadcast services with the same name, which can be inferred from the service names in the mDNS broadcasts. Moreover, after I blocked one of the hosts, the daemon returned to normal. You can try reproducing this by having several Windows hosts broadcast services with the same name.

**Comment by evverx** [comment]
Once again please try reproducing it with the master branch of avahi, open a new issue and add all the relevant details. I'm still not sure what you think the issue is. I haven't seen "a cascading failure that brings down the entire daemon" so it must be something else.

**Comment by echo-hi** [comment]
I think I may have mistakenly used the term 'cascading failure'. The issue here is not that the daemon crashes with a segmentation fault or similar.I discovered that when the daemon prints the above messages, the return value of the DNSServiceBrowse function in my application is consistently -65537.

i have open a new issue and add all the relevant details :https://github.com/avahi/avahi/issues/792

**Comment by evverx** [comment]
I still think it would be great if you tried reproducing with the master branch where commits like 93b14365c1c1e04efd1a890e8caa01a2a514bfd8 are included (I'm not sure whether they all have been backported to the Ubuntu package). That being said as far as I understand it affects `DNSServiceBrowse` from the compat layer and it isn't actively maintained anymore. I'll keep the issue open though.

**Comment by echo-hi** [comment]
I am not at my workstation now; I'm off work, so I don’t know the exact commit details.
However, I remember I pulled the master branch in the first half of this year, so it definitely includes the changes you mentioned.
I don’t think this is necessarily an issue with the compatibility layer, because avahi-browse also returns errors. It prints the PTR information of specific services, but some resolve information may return timeout errors.

**Comment by echo-hi** [comment]
sometimes avahi-browes return err, i am not sure it relates to 'normalize name' issue.

![Image](https://github.com/user-attachments/assets/7a635788-6312-43de-837f-1dac9203bf4a)

**Comment by evverx** [comment]
>  However, I remember I pulled the master branch in the first half of this year, so it definitely includes the changes you mentioned.

Can you double-check and mention the SHA in the issue to rule out all the known issues? Can you also attach the packets just in case?

>  I don’t think this is necessarily an issue with the compatibility layer, because avahi-browse also returns errors. It prints the PTR information of specific services, but some resolve information may return timeout errors.

avahi-browse keeps working and keeps keeping track of services so it can't be DoSed by those malformed service names. I've just advertised a malformed service, got
```sh
avahi_normalize_name() failed.
avahi_key_new() failed.
```
but avahi-browse was fine in the sense that it kept showing the other services when they were advertised or when they were no longer advertised because the goodbye packets were sent.

The compat layer goes down as far as I understand. Either way the compat library is unlikely to be fixed.

> avahi-browes return err

If it returns a zero exit code when it should a non-zero exit code it would be a separate bug but the screenshot indicates that that the commits rejecting bogus services aren't included in your build. Please try reproducing it with the master branch.
